Sheet: All Iterations
A1: Data source
A2: Dataset | B2: jun18dell-bp | G2: jun19dell-bp | Q2: jun17mac-bp | V2: jun19mac-bp | AD2: jun17dell-df | AI2: jun18dell-df | AO2: jun19dell-df | AP2: jun18mac-df | AX2: jun18mac-df
A3: Windows logging configuration | B3: best practice | G3: best practice | Q3: best practice | V3: best practice | AD3: default | AI3: default | AO3: default | AP3: default | AX3: default
A4: Iteration | B4: 1 | C4: 2 | D4: 3 | E4: 4 | F4: 5 | G4: 1 | H4: 2 | I4: 3 | J4: 4 | K4: 5 | L4: 6 | M4: 7 | N4: 8 | O4: 9 | P4: 10 | Q4: 1 | R4: 2 | S4: 3 | T4: 4 | U4: 5 | V4: 1 | W4: 2 | X4: 3 | Y4: 4 | Z4: 5 | AA4: 6 | AB4: 7 | AC4: 8 | AD4: 1 | AE4: 2 | AF4: 3 | AG4: 4 | AH4: 5 | AI4: 1 | AJ4: 2 | AK4: 3 | AL4: 4 | AM4: 5 | AN4: 6 | AO4: 1 | AP4: 1 | AQ4: 2 | AR4: 3 | AS4: 4 | AT4: 5 | AU4: 6 | AV4: 7 | AW4: 8 | AX4: 1 | AY4: 2
A5: No errors in simulations.log? Cat simulations.log | B5: ✓ | C5: ✓ | D5: ✓ | E5: ✓ | F5: ✓ | G5: ✓ | H5: ✓ | I5: ✓ | J5: ✓ | K5: ❌ | L5: ✓ | M5: ✓ | N5: ✓ | O5: ✓ | P5: ✓ | Q5: ✓ | R5: ✓ | S5: ✓ | T5: ✓ | U5: ✓ | V5: ✓ | W5: ✓ | X5: ✓ | Y5: ✓ | Z5: ✓ | AA5: ✓ | AB5: ✓ | AC5: ✓ | AD5: ✓ | AE5: ✓ | AF5: ✓ | AG5: ✓ | AH5: ✓ | AI5: ✓ | AJ5: ✓ | AK5: ✓ | AL5: ✓ | AM5: ✓ | AN5: ✓ | AO5: ✓ | AP5: ✓ | AQ5: ✓ | AR5: ✓ | AS5: ✓ | AT5: ✓ | AU5: ✓ | AV5: ✓ | AW5: ✓ | AX5: ✓ | AY5: ✓
A6: All attacks successful? Grep attack_succeeded attackconsole_*.log | wc -l | B6: ✓ | C6: ✓ | D6: ✓ | E6: ✓ | F6: ❌ | G6: ✓ | H6: ✓ | I6: ✓ | J6: ❌ | K6: ✓ | L6: ❌ | M6: ✓ | N6: ✓ | O6: ✓ | P6: ✓ | Q6: ✓ | R6: ✓ | S6: ✓ | T6: ✓ | U6: ✓ | V6: ✓ | W6: ✓ | X6: ✓ | Y6: ✓ | Z6: ✓ | AA6: ✓ | AB6: ✓ | AC6: ✓ | AD6: ✓ | AE6: ✓ | AF6: ✓ | AG6: ❌ | AH6: ✓ | AI6: ✓ | AJ6: ✓ | AK6: ✓ | AL6: ✓ | AM6: ❌ | AN6: ✓ | AO6: ✓ | AP6: ✓ | AQ6: ✓ | AR6: ✓ | AS6: ✓ | AT6: ✓ | AU6: ✓ | AV6: ✓ | AW6: ✓ | AX6: ✓ | AY6: ✓
A7: Sigma for i in {1..5}; count_tps_sigma.py sigma_$i.jsonl
A8: Autorun Keys Modification | B8: 1 | C8: 1 | D8: 1 | E8: 1 | F8: 1 | G8: 1 | H8: 1 | I8: 1 | J8: 1 | K8: 0 | L8: 1 | M8: 1 | N8: 1 | O8: 1 | P8: 1 | Q8: 1 | R8: 1 | S8: 1 | T8: 1 | U8: 1 | V8: 1 | W8: 1 | X8: 1 | Y8: 1 | Z8: 1 | AA8: 1 | AB8: 1 | AC8: 1 | AD8: 0 | AE8: 0 | AF8: 0 | AG8: 0 | AH8: 0 | AI8: 0 | AJ8: 0 | AK8: 0 | AL8: 0 | AM8: 0 | AN8: 0 | AO8: 0 | AP8: 0 | AQ8: 0 | AR8: 0 | AS8: 0 | AT8: 0 | AU8: 0 | AV8: 0 | AW8: 0 | AX8: 0 | AY8: 0
A9: Direct Autorun Keys Modification | B9: 1 | C9: 1 | D9: 1 | E9: 1 | F9: 1 | G9: 1 | H9: 1 | I9: 1 | J9: 1 | K9: 0 | L9: 1 | M9: 1 | N9: 1 | O9: 1 | P9: 1 | Q9: 1 | R9: 1 | S9: 1 | T9: 1 | U9: 1 | V9: 1 | W9: 1 | X9: 1 | Y9: 1 | Z9: 1 | AA9: 1 | AB9: 1 | AC9: 1 | AD9: 0 | AE9: 0 | AF9: 0 | AG9: 0 | AH9: 0 | AI9: 0 | AJ9: 0 | AK9: 0 | AL9: 0 | AM9: 0 | AN9: 0 | AO9: 0 | AP9: 0 | AQ9: 0 | AR9: 0 | AS9: 0 | AT9: 0 | AU9: 0 | AV9: 0 | AW9: 0 | AX9: 0 | AY9: 0
A10: Meterpreter or Cobalt Strike Getsystem Service Start | B10: 1 | C10: 1 | D10: 1 | E10: 1 | F10: 0 | G10: 1 | H10: 1 | I10: 1 | J10: 0 | K10: 0 | L10: 0 | M10: 1 | N10: 1 | O10: 1 | P10: 1 | Q10: 1 | R10: 1 | S10: 1 | T10: 1 | U10: 1 | V10: 1 | W10: 1 | X10: 1 | Y10: 1 | Z10: 1 | AA10: 1 | AB10: 1 | AC10: 1 | AD10: 0 | AE10: 0 | AF10: 0 | AG10: 0 | AH10: 0 | AI10: 0 | AJ10: 0 | AK10: 0 | AL10: 0 | AM10: 0 | AN10: 0 | AO10: 0 | AP10: 0 | AQ10: 0 | AR10: 0 | AS10: 0 | AT10: 0 | AU10: 0 | AV10: 0 | AW10: 0 | AX10: 0 | AY10: 0
A11: Non Interactive PowerShell | B11: 1 | C11: 1 | D11: 1 | E11: 1 | F11: 1 | G11: 1 | H11: 1 | I11: 1 | J11: 1 | K11: 0 | L11: 1 | M11: 1 | N11: 1 | O11: 1 | P11: 1 | Q11: 1 | R11: 1 | S11: 1 | T11: 1 | U11: 1 | V11: 1 | W11: 1 | X11: 1 | Y11: 1 | Z11: 1 | AA11: 1 | AB11: 1 | AC11: 1 | AD11: 0 | AE11: 0 | AF11: 0 | AG11: 0 | AH11: 0 | AI11: 0 | AJ11: 0 | AK11: 0 | AL11: 0 | AM11: 0 | AN11: 0 | AO11: 0 | AP11: 0 | AQ11: 0 | AR11: 0 | AS11: 0 | AT11: 0 | AU11: 0 | AV11: 0 | AW11: 0 | AX11: 0 | AY11: 0
A12: Windows PowerShell Web Request | B12: 3 | C12: 3 | D12: 3 | E12: 3 | F12: 3 | G12: 3 | H12: 3 | I12: 3 | J12: 3 | K12: 0 | L12: 3 | M12: 3 | N12: 3 | O12: 3 | P12: 3 | Q12: 3 | R12: 3 | S12: 3 | T12: 3 | U12: 3 | V12: 3 | W12: 3 | X12: 3 | Y12: 3 | Z12: 3 | AA12: 3 | AB12: 3 | AC12: 3 | AD12: 0 | AE12: 0 | AF12: 0 | AG12: 0 | AH12: 0 | AI12: 0 | AJ12: 0 | AK12: 0 | AL12: 0 | AM12: 0 | AN12: 0 | AO12: 0 | AP12: 0 | AQ12: 0 | AR12: 0 | AS12: 0 | AT12: 0 | AU12: 0 | AV12: 0 | AW12: 0 | AX12: 0 | AY12: 0
A13: Suricata for i in {1..5}; python3 ../../count_tps_suricata.py syslog_$i.jsonl
A14: ET INFO EXE IsDebuggerPresent (Used in Malware Anti-Debugging) | B14: 1 | C14: 1 | D14: 1 | E14: 1 | F14: 0 | G14: 1 | H14: 1 | I14: 1 | J14: 0 | K14: 0 | L14: 0 | M14: 1 | N14: 1 | O14: 1 | P14: 1 | Q14: 1 | R14: 1 | S14: 1 | T14: 1 | U14: 1 | V14: 1 | W14: 1 | X14: 1 | Y14: 1 | Z14: 1 | AA14: 1 | AB14: 1 | AC14: 1 | AD14: 1 | AE14: 1 | AF14: 1 | AG14: 0 | AH14: 1 | AI14: 1 | AJ14: 1 | AK14: 1 | AL14: 1 | AM14: 0 | AN14: 1 | AO14: 1 | AP14: 1 | AQ14: 1 | AR14: 1 | AS14: 1 | AT14: 1 | AU14: 1 | AV14: 1 | AW14: 1 | AX14: 1 | AY14: 1
A15: ET INFO Executable Download from dotted-quad Host | B15: 1 | C15: 1 | D15: 1 | E15: 1 | F15: 0 | G15: 1 | H15: 1 | I15: 1 | J15: 0 | K15: 0 | L15: 0 | M15: 1 | N15: 1 | O15: 1 | P15: 1 | Q15: 1 | R15: 1 | S15: 1 | T15: 1 | U15: 1 | V15: 1 | W15: 1 | X15: 1 | Y15: 1 | Z15: 1 | AA15: 1 | AB15: 1 | AC15: 1 | AD15: 1 | AE15: 1 | AF15: 1 | AG15: 0 | AH15: 1 | AI15: 1 | AJ15: 1 | AK15: 1 | AL15: 1 | AM15: 0 | AN15: 1 | AO15: 1 | AP15: 1 | AQ15: 1 | AR15: 1 | AS15: 1 | AT15: 1 | AU15: 1 | AV15: 1 | AW15: 1 | AX15: 1 | AY15: 1
A16: ET INFO Executable Retrieved With Minimal HTTP Headers - Potential Second Stage Download | B16: 1 | C16: 1 | D16: 1 | E16: 1 | F16: 0 | G16: 1 | H16: 1 | I16: 1 | J16: 0 | K16: 0 | L16: 0 | M16: 1 | N16: 1 | O16: 1 | P16: 1 | Q16: 1 | R16: 1 | S16: 1 | T16: 1 | U16: 1 | V16: 1 | W16: 1 | X16: 1 | Y16: 1 | Z16: 1 | AA16: 1 | AB16: 1 | AC16: 1 | AD16: 1 | AE16: 1 | AF16: 1 | AG16: 0 | AH16: 1 | AI16: 1 | AJ16: 1 | AK16: 1 | AL16: 1 | AM16: 0 | AN16: 1 | AO16: 1 | AP16: 1 | AQ16: 1 | AR16: 1 | AS16: 1 | AT16: 1 | AU16: 1 | AV16: 1 | AW16: 1 | AX16: 1 | AY16: 1
A17: ET INFO SUSPICIOUS Dotted Quad Host MZ Response | B17: 2 | C17: 2 | D17: 2 | E17: 2 | F17: 0 | G17: 2 | H17: 2 | I17: 2 | J17: 0 | K17: 0 | L17: 0 | M17: 2 | N17: 2 | O17: 2 | P17: 2 | Q17: 2 | R17: 2 | S17: 2 | T17: 2 | U17: 2 | V17: 2 | W17: 2 | X17: 2 | Y17: 2 | Z17: 2 | AA17: 2 | AB17: 2 | AC17: 2 | AD17: 2 | AE17: 2 | AF17: 2 | AG17: 0 | AH17: 2 | AI17: 2 | AJ17: 2 | AK17: 2 | AL17: 2 | AM17: 0 | AN17: 2 | AO17: 2 | AP17: 2 | AQ17: 2 | AR17: 2 | AS17: 2 | AT17: 2 | AU17: 2 | AV17: 2 | AW17: 2 | AX17: 2 | AY17: 2
A18: ET INFO SUSPICIOUS SMTP EXE - EXE SMTP Attachment | B18: 2 | C18: 2 | D18: 2 | E18: 2 | F18: 0 | G18: 2 | H18: 2 | I18: 2 | J18: 0 | K18: 0 | L18: 0 | M18: 2 | N18: 2 | O18: 2 | P18: 2 | Q18: 2 | R18: 2 | S18: 2 | T18: 2 | U18: 2 | V18: 2 | W18: 2 | X18: 2 | Y18: 2 | Z18: 2 | AA18: 2 | AB18: 2 | AC18: 2 | AD18: 2 | AE18: 2 | AF18: 2 | AG18: 0 | AH18: 2 | AI18: 2 | AJ18: 2 | AK18: 2 | AL18: 2 | AM18: 0 | AN18: 2 | AO18: 2 | AP18: 2 | AQ18: 2 | AR18: 2 | AS18: 2 | AT18: 2 | AU18: 2 | AV18: 2 | AW18: 2 | AX18: 2 | AY18: 2
A19: ET POLICY PE EXE or DLL Windows file download HTTP | B19: 2 | C19: 2 | D19: 2 | E19: 2 | F19: 0 | G19: 2 | H19: 2 | I19: 2 | J19: 0 | K19: 0 | L19: 0 | M19: 2 | N19: 2 | O19: 2 | P19: 2 | Q19: 2 | R19: 2 | S19: 2 | T19: 2 | U19: 2 | V19: 2 | W19: 2 | X19: 2 | Y19: 2 | Z19: 2 | AA19: 2 | AB19: 2 | AC19: 2 | AD19: 2 | AE19: 2 | AF19: 2 | AG19: 0 | AH19: 2 | AI19: 2 | AJ19: 2 | AK19: 2 | AL19: 2 | AM19: 0 | AN19: 2 | AO19: 2 | AP19: 2 | AQ19: 2 | AR19: 2 | AS19: 2 | AT19: 2 | AU19: 2 | AV19: 2 | AW19: 2 | AX19: 2 | AY19: 2
A20: ET SCAN Sqlmap SQL Injection Scan | B20: 2 | C20: 2 | D20: 2 | E20: 2 | F20: 0 | G20: 2 | H20: 2 | I20: 2 | J20: 0 | K20: 0 | L20: 0 | M20: 2 | N20: 2 | O20: 2 | P20: 2 | Q20: 2 | R20: 2 | S20: 2 | T20: 2 | U20: 2 | V20: 2 | W20: 2 | X20: 2 | Y20: 2 | Z20: 2 | AA20: 2 | AB20: 2 | AC20: 2 | AD20: 2 | AE20: 2 | AF20: 2 | AG20: 0 | AH20: 2 | AI20: 2 | AJ20: 2 | AK20: 2 | AL20: 2 | AM20: 0 | AN20: 2 | AO20: 2 | AP20: 2 | AQ20: 2 | AR20: 2 | AS20: 2 | AT20: 2 | AU20: 2 | AV20: 2 | AW20: 2 | AX20: 2 | AY20: 2
A21: ET TROJAN Possible Metasploit Payload Common Construct Bind_API (from server) | B21: 2 | C21: 1 | D21: 2 | E21: 2 | F21: 0 | G21: 2 | H21: 2 | I21: 1 | J21: 0 | K21: 0 | L21: 0 | M21: 2 | N21: 1 | O21: 2 | P21: 2 | Q21: 2 | R21: 2 | S21: 2 | T21: 1 | U21: 2 | V21: 2 | W21: 2 | X21: 2 | Y21: 2 | Z21: 2 | AA21: 2 | AB21: 2 | AC21: 2 | AD21: 2 | AE21: 1 | AF21: 2 | AG21: 0 | AH21: 1 | AI21: 2 | AJ21: 2 | AK21: 2 | AL21: 1 | AM21: 0 | AN21: 2 | AO21: 2 | AP21: 2 | AQ21: 2 | AR21: 2 | AS21: 2 | AT21: 2 | AU21: 2 | AV21: 2 | AW21: 2 | AX21: 2 | AY21: 1
A22: ET WEB_SERVER ATTACKER SQLi - SELECT and Schema Columns | B22: 6 | C22: 7 | D22: 7 | E22: 2 | F22: 0 | G22: 7 | H22: 5 | I22: 7 | J22: 0 | K22: 0 | L22: 0 | M22: 6 | N22: 7 | O22: 7 | P22: 6 | Q22: 6 | R22: 7 | S22: 6 | T22: 7 | U22: 6 | V22: 7 | W22: 6 | X22: 6 | Y22: 7 | Z22: 6 | AA22: 6 | AB22: 8 | AC22: 6 | AD22: 8 | AE22: 6 | AF22: 7 | AG22: 0 | AH22: 6 | AI22: 6 | AJ22: 6 | AK22: 6 | AL22: 6 | AM22: 0 | AN22: 7 | AO22: 6 | AP22: 8 | AQ22: 6 | AR22: 7 | AS22: 6 | AT22: 7 | AU22: 6 | AV22: 7 | AW22: 6 | AX22: 7 | AY22: 6
A23: ET WEB_SERVER Attempt To Access MSSQL xp_cmdshell Stored Procedure Via URI | B23: 1 | C23: 1 | D23: 1 | E23: 1 | F23: 0 | G23: 1 | H23: 1 | I23: 1 | J23: 0 | K23: 0 | L23: 0 | M23: 1 | N23: 1 | O23: 1 | P23: 1 | Q23: 1 | R23: 1 | S23: 1 | T23: 1 | U23: 1 | V23: 1 | W23: 1 | X23: 1 | Y23: 1 | Z23: 1 | AA23: 1 | AB23: 1 | AC23: 1 | AD23: 1 | AE23: 1 | AF23: 1 | AG23: 0 | AH23: 1 | AI23: 1 | AJ23: 1 | AK23: 1 | AL23: 1 | AM23: 0 | AN23: 1 | AO23: 1 | AP23: 1 | AQ23: 1 | AR23: 1 | AS23: 1 | AT23: 1 | AU23: 1 | AV23: 1 | AW23: 1 | AX23: 1 | AY23: 1
A24: ET WEB_SERVER MYSQL Benchmark Command in URI to Consume Server Resources | B24: 2 | C24: 2 | D24: 2 | E24: 2 | F24: 0 | G24: 2 | H24: 2 | I24: 2 | J24: 0 | K24: 0 | L24: 0 | M24: 2 | N24: 2 | O24: 2 | P24: 2 | Q24: 2 | R24: 2 | S24: 2 | T24: 2 | U24: 2 | V24: 2 | W24: 2 | X24: 2 | Y24: 2 | Z24: 2 | AA24: 2 | AB24: 2 | AC24: 2 | AD24: 2 | AE24: 2 | AF24: 2 | AG24: 0 | AH24: 2 | AI24: 2 | AJ24: 2 | AK24: 2 | AL24: 2 | AM24: 0 | AN24: 2 | AO24: 2 | AP24: 2 | AQ24: 2 | AR24: 2 | AS24: 2 | AT24: 2 | AU24: 2 | AV24: 2 | AW24: 2 | AX24: 2 | AY24: 2
A25: ET WEB_SERVER MYSQL SELECT CONCAT SQL Injection Attempt | B25: 22 | C25: 22 | D25: 22 | E25: 22 | F25: 0 | G25: 22 | H25: 22 | I25: 22 | J25: 0 | K25: 0 | L25: 0 | M25: 22 | N25: 22 | O25: 22 | P25: 22 | Q25: 22 | R25: 22 | S25: 22 | T25: 22 | U25: 22 | V25: 22 | W25: 22 | X25: 22 | Y25: 22 | Z25: 22 | AA25: 22 | AB25: 22 | AC25: 22 | AD25: 22 | AE25: 22 | AF25: 22 | AG25: 0 | AH25: 22 | AI25: 22 | AJ25: 22 | AK25: 22 | AL25: 22 | AM25: 0 | AN25: 22 | AO25: 22 | AP25: 22 | AQ25: 22 | AR25: 22 | AS25: 22 | AT25: 22 | AU25: 22 | AV25: 22 | AW25: 22 | AX25: 22 | AY25: 22
A26: ET WEB_SERVER Possible attempt to enumerate MS SQL Server version | B26: 2 | C26: 2 | D26: 2 | E26: 2 | F26: 0 | G26: 2 | H26: 2 | I26: 2 | J26: 0 | K26: 0 | L26: 0 | M26: 2 | N26: 2 | O26: 2 | P26: 2 | Q26: 2 | R26: 2 | S26: 2 | T26: 2 | U26: 2 | V26: 2 | W26: 2 | X26: 2 | Y26: 2 | Z26: 2 | AA26: 2 | AB26: 2 | AC26: 2 | AD26: 2 | AE26: 2 | AF26: 2 | AG26: 0 | AH26: 2 | AI26: 2 | AJ26: 2 | AK26: 2 | AL26: 2 | AM26: 0 | AN26: 2 | AO26: 6 | AP26: 2 | AQ26: 2 | AR26: 2 | AS26: 2 | AT26: 2 | AU26: 2 | AV26: 2 | AW26: 2 | AX26: 2 | AY26: 2
A27: ET WEB_SERVER Possible Attempt to Get SQL Server Version in URI using SELECT VERSION | B27: 6 | C27: 6 | D27: 6 | E27: 6 | F27: 0 | G27: 6 | H27: 6 | I27: 6 | J27: 0 | K27: 0 | L27: 0 | M27: 6 | N27: 6 | O27: 6 | P27: 6 | Q27: 6 | R27: 6 | S27: 6 | T27: 6 | U27: 6 | V27: 6 | W27: 6 | X27: 6 | Y27: 6 | Z27: 6 | AA27: 6 | AB27: 6 | AC27: 6 | AD27: 6 | AE27: 6 | AF27: 6 | AG27: 0 | AH27: 6 | AI27: 6 | AJ27: 6 | AK27: 6 | AL27: 6 | AM27: 0 | AN27: 6 | AO27: 4 | AP27: 6 | AQ27: 6 | AR27: 6 | AS27: 6 | AT27: 6 | AU27: 6 | AV27: 6 | AW27: 6 | AX27: 6 | AY27: 6
A28: ET WEB_SERVER Possible MySQL SQLi Attempt Information Schema Access | B28: 4 | C28: 4 | D28: 4 | E28: 4 | F28: 0 | G28: 4 | H28: 4 | I28: 4 | J28: 0 | K28: 0 | L28: 0 | M28: 4 | N28: 4 | O28: 4 | P28: 4 | Q28: 4 | R28: 4 | S28: 4 | T28: 4 | U28: 4 | V28: 4 | W28: 4 | X28: 4 | Y28: 4 | Z28: 4 | AA28: 4 | AB28: 4 | AC28: 4 | AD28: 4 | AE28: 4 | AF28: 4 | AG28: 0 | AH28: 4 | AI28: 4 | AJ28: 4 | AK28: 4 | AL28: 4 | AM28: 0 | AN28: 4 | AO28: 16 | AP28: 4 | AQ28: 4 | AR28: 4 | AS28: 4 | AT28: 4 | AU28: 4 | AV28: 4 | AW28: 4 | AX28: 4 | AY28: 4
A29: ET WEB_SERVER Possible SQL Injection Attempt SELECT FROM | B29: 16 | C29: 16 | D29: 16 | E29: 16 | F29: 0 | G29: 16 | H29: 16 | I29: 16 | J29: 0 | K29: 0 | L29: 0 | M29: 16 | N29: 16 | O29: 16 | P29: 16 | Q29: 16 | R29: 16 | S29: 16 | T29: 16 | U29: 16 | V29: 16 | W29: 16 | X29: 16 | Y29: 16 | Z29: 16 | AA29: 16 | AB29: 16 | AC29: 16 | AD29: 16 | AE29: 16 | AF29: 16 | AG29: 0 | AH29: 16 | AI29: 16 | AJ29: 16 | AK29: 16 | AL29: 16 | AM29: 0 | AN29: 16 | AO29: 19 | AP29: 16 | AQ29: 16 | AR29: 16 | AS29: 16 | AT29: 16 | AU29: 16 | AV29: 16 | AW29: 16 | AX29: 16 | AY29: 16
A30: ET WEB_SERVER Possible SQL Injection Attempt UNION SELECT | B30: 19 | C30: 19 | D30: 19 | E30: 19 | F30: 0 | G30: 19 | H30: 19 | I30: 19 | J30: 0 | K30: 0 | L30: 0 | M30: 19 | N30: 19 | O30: 19 | P30: 19 | Q30: 19 | R30: 19 | S30: 19 | T30: 19 | U30: 19 | V30: 19 | W30: 19 | X30: 19 | Y30: 19 | Z30: 19 | AA30: 19 | AB30: 19 | AC30: 19 | AD30: 19 | AE30: 19 | AF30: 19 | AG30: 0 | AH30: 19 | AI30: 19 | AJ30: 19 | AK30: 19 | AL30: 19 | AM30: 0 | AN30: 19 | AO30: 2 | AP30: 19 | AQ30: 19 | AR30: 19 | AS30: 19 | AT30: 19 | AU30: 19 | AV30: 19 | AW30: 19 | AX30: 19 | AY30: 19
A31: ET WEB_SERVER Script tag in URI Possible Cross Site Scripting Attempt | B31: 1 | C31: 1 | D31: 1 | E31: 1 | F31: 0 | G31: 1 | H31: 1 | I31: 1 | J31: 0 | K31: 0 | L31: 0 | M31: 1 | N31: 1 | O31: 1 | P31: 1 | Q31: 1 | R31: 1 | S31: 1 | T31: 1 | U31: 1 | V31: 1 | W31: 1 | X31: 1 | Y31: 1 | Z31: 1 | AA31: 1 | AB31: 1 | AC31: 1 | AD31: 1 | AE31: 1 | AF31: 1 | AG31: 0 | AH31: 1 | AI31: 1 | AJ31: 1 | AK31: 1 | AL31: 1 | AM31: 0 | AN31: 1 | AO31: 36 | AP31: 1 | AQ31: 1 | AR31: 1 | AS31: 1 | AT31: 1 | AU31: 1 | AV31: 1 | AW31: 1 | AX31: 1 | AY31: 1
A32: ET WEB_SERVER SQL Errors in HTTP 200 Response (error in your SQL syntax) | B32: 36 | C32: 36 | D32: 36 | E32: 36 | F32: 0 | G32: 36 | H32: 36 | I32: 36 | J32: 0 | K32: 0 | L32: 0 | M32: 36 | N32: 36 | O32: 36 | P32: 36 | Q32: 36 | R32: 36 | S32: 36 | T32: 36 | U32: 36 | V32: 36 | W32: 36 | X32: 36 | Y32: 36 | Z32: 36 | AA32: 36 | AB32: 36 | AC32: 36 | AD32: 36 | AE32: 36 | AF32: 36 | AG32: 0 | AH32: 36 | AI32: 36 | AJ32: 36 | AK32: 36 | AL32: 36 | AM32: 0 | AN32: 36 | AO32: 7 | AP32: 36 | AQ32: 36 | AR32: 36 | AS32: 36 | AT32: 36 | AU32: 36 | AV32: 36 | AW32: 36 | AX32: 36 | AY32: 36
A33: ET WEB_SERVER SQL Injection Select Sleep Time Delay | B33: 7 | C33: 7 | D33: 7 | E33: 7 | F33: 0 | G33: 7 | H33: 7 | I33: 7 | J33: 0 | K33: 0 | L33: 0 | M33: 7 | N33: 7 | O33: 7 | P33: 7 | Q33: 7 | R33: 7 | S33: 7 | T33: 7 | U33: 7 | V33: 7 | W33: 7 | X33: 7 | Y33: 7 | Z33: 7 | AA33: 7 | AB33: 7 | AC33: 7 | AD33: 7 | AE33: 7 | AF33: 7 | AG33: 0 | AH33: 7 | AI33: 7 | AJ33: 7 | AK33: 7 | AL33: 7 | AM33: 0 | AN33: 7 | AO33: 1 | AP33: 7 | AQ33: 7 | AR33: 7 | AS33: 7 | AT33: 7 | AU33: 7 | AV33: 7 | AW33: 7 | AX33: 7 | AY33: 7
A34: Attack steps
A35: Scan and exploit web server | B35: of:=SUM([.B22:.B33])+[.B20] -> 124 | C35: of:=SUM([.C22:.C33])+[.C20] -> 125 | D35: of:=SUM([.D22:.D33])+[.D20] -> 125 | E35: of:=SUM([.E22:.E33])+[.E20] -> 120 | F35: of:=SUM([.F22:.F33])+[.F20] -> 0 | G35: of:=SUM([.G22:.G33])+[.G20] -> 125 | H35: of:=SUM([.H22:.H33])+[.H20] -> 123 | I35: of:=SUM([.I22:.I33])+[.I20] -> 125 | J35: of:=SUM([.J22:.J33])+[.J20] -> 0 | K35: of:=SUM([.K22:.K33])+[.K20] -> 0 | L35: of:=SUM([.L22:.L33])+[.L20] -> 0 | M35: of:=SUM([.M22:.M33])+[.M20] -> 124 | N35: of:=SUM([.N22:.N33])+[.N20] -> 125 | O35: of:=SUM([.O22:.O33])+[.O20] -> 125 | P35: of:=SUM([.P22:.P33])+[.P20] -> 124 | Q35: of:=SUM([.Q22:.Q33])+[.Q20] -> 124 | R35: of:=SUM([.R22:.R33])+[.R20] -> 125 | S35: of:=SUM([.S22:.S33])+[.S20] -> 124 | T35: of:=SUM([.T22:.T33])+[.T20] -> 125 | U35: of:=SUM([.U22:.U33])+[.U20] -> 124 | V35: of:=SUM([.V22:.V33])+[.V20] -> 125 | W35: of:=SUM([.W22:.W33])+[.W20] -> 124 | X35: of:=SUM([.X22:.X33])+[.X20] -> 124 | Y35: of:=SUM([.Y22:.Y33])+[.Y20] -> 125 | Z35: of:=SUM([.Z22:.Z33])+[.Z20] -> 124 | AA35: of:=SUM([.AA22:.AA33])+[.AA20] -> 124 | AB35: of:=SUM([.AB22:.AB33])+[.AB20] -> 126 | AC35: of:=SUM([.AC22:.AC33])+[.AC20] -> 124 | AD35: of:=SUM([.AD22:.AD33])+[.AD20] -> 126 | AE35: of:=SUM([.AE22:.AE33])+[.AE20] -> 124 | AF35: of:=SUM([.AF22:.AF33])+[.AF20] -> 125 | AG35: of:=SUM([.AG22:.AG33])+[.AG20] -> 0 | AH35: of:=SUM([.AH22:.AH33])+[.AH20] -> 124 | AI35: of:=SUM([.AI22:.AI33])+[.AI20] -> 124 | AJ35: of:=SUM([.AJ22:.AJ33])+[.AJ20] -> 124 | AK35: of:=SUM([.AK22:.AK33])+[.AK20] -> 124 | AL35: of:=SUM([.AL22:.AL33])+[.AL20] -> 124 | AM35: of:=SUM([.AM22:.AM33])+[.AM20] -> 0 | AN35: of:=SUM([.AN22:.AN33])+[.AN20] -> 125 | AO35: of:=SUM([.AO22:.AO33])+[.AO20] -> 124 | AP35: of:=SUM([.AP22:.AP33])+[.AP20] -> 126 | AQ35: of:=SUM([.AQ22:.AQ33])+[.AQ20] -> 124 | AR35: of:=SUM([.AR22:.AR33])+[.AR20] -> 125 | AS35: of:=SUM([.AS22:.AS33])+[.AS20] -> 124 | AT35: of:=SUM([.AT22:.AT33])+[.AT20] -> 125 | AU35: of:=SUM([.AU22:.AU33])+[.AU20] -> 124 | AV35: of:=SUM([.AV22:.AV33])+[.AV20] -> 125 | AW35: of:=SUM([.AW22:.AW33])+[.AW20] -> 124 | AX35: of:=SUM([.AX22:.AX33])+[.AX20] -> 125 | AY35: of:=SUM([.AY22:.AY33])+[.AY20] -> 124
A36: Send email with malicious attachment | B36: of:=[.B18] -> 2 | C36: of:=[.C18] -> 2 | D36: of:=[.D18] -> 2 | E36: of:=[.E18] -> 2 | F36: of:=[.F18] -> 0 | G36: of:=[.G18] -> 2 | H36: of:=[.H18] -> 2 | I36: of:=[.I18] -> 2 | J36: of:=[.J18] -> 0 | K36: of:=[.K18] -> 0 | L36: of:=[.L18] -> 0 | M36: of:=[.M18] -> 2 | N36: of:=[.N18] -> 2 | O36: of:=[.O18] -> 2 | P36: of:=[.P18] -> 2 | Q36: of:=[.Q18] -> 2 | R36: of:=[.R18] -> 2 | S36: of:=[.S18] -> 2 | T36: of:=[.T18] -> 2 | U36: of:=[.U18] -> 2 | V36: of:=[.V18] -> 2 | W36: of:=[.W18] -> 2 | X36: of:=[.X18] -> 2 | Y36: of:=[.Y18] -> 2 | Z36: of:=[.Z18] -> 2 | AA36: of:=[.AA18] -> 2 | AB36: of:=[.AB18] -> 2 | AC36: of:=[.AC18] -> 2 | AD36: of:=[.AD18] -> 2 | AE36: of:=[.AE18] -> 2 | AF36: of:=[.AF18] -> 2 | AG36: of:=[.AG18] -> 0 | AH36: of:=[.AH18] -> 2 | AI36: of:=[.AI18] -> 2 | AJ36: of:=[.AJ18] -> 2 | AK36: of:=[.AK18] -> 2 | AL36: of:=[.AL18] -> 2 | AM36: of:=[.AM18] -> 0 | AN36: of:=[.AN18] -> 2 | AO36: of:=[.AO18] -> 2 | AP36: of:=[.AP18] -> 2 | AQ36: of:=[.AQ18] -> 2 | AR36: of:=[.AR18] -> 2 | AS36: of:=[.AS18] -> 2 | AT36: of:=[.AT18] -> 2 | AU36: of:=[.AU18] -> 2 | AV36: of:=[.AV18] -> 2 | AW36: of:=[.AW18] -> 2 | AX36: of:=[.AX18] -> 2 | AY36: of:=[.AY18] -> 2
A37: Open malicious attachment | B37: of:=[.B19]/2+[.B16]+[.B17]/2+[.B14]+[.B21] -> 6 | C37: of:=[.C19]/2+[.C16]+[.C17]/2+[.C14]+[.C21] -> 5 | D37: of:=[.D19]/2+[.D16]+[.D17]/2+[.D14]+[.D21] -> 6 | E37: of:=[.E19]/2+[.E16]+[.E17]/2+[.E14]+[.E21] -> 6 | F37: of:=[.F19]/2+[.F16]+[.F17]/2+[.F14]+[.F21] -> 0 | G37: of:=[.G19]/2+[.G16]+[.G17]/2+[.G14]+[.G21] -> 6 | H37: of:=[.H19]/2+[.H16]+[.H17]/2+[.H14]+[.H21] -> 6 | I37: of:=[.I19]/2+[.I16]+[.I17]/2+[.I14]+[.I21] -> 5 | J37: of:=[.J19]/2+[.J16]+[.J17]/2+[.J14]+[.J21] -> 0 | K37: of:=[.K19]/2+[.K16]+[.K17]/2+[.K14]+[.K21] -> 0 | L37: of:=[.L19]/2+[.L16]+[.L17]/2+[.L14]+[.L21] -> 0 | M37: of:=[.M19]/2+[.M16]+[.M17]/2+[.M14]+[.M21] -> 6 | N37: of:=[.N19]/2+[.N16]+[.N17]/2+[.N14]+[.N21] -> 5 | O37: of:=[.O19]/2+[.O16]+[.O17]/2+[.O14]+[.O21] -> 6 | P37: of:=[.P19]/2+[.P16]+[.P17]/2+[.P14]+[.P21] -> 6 | Q37: of:=[.Q19]/2+[.Q16]+[.Q17]/2+[.Q14]+[.Q21] -> 6 | R37: of:=[.R19]/2+[.R16]+[.R17]/2+[.R14]+[.R21] -> 6 | S37: of:=[.S19]/2+[.S16]+[.S17]/2+[.S14]+[.S21] -> 6 | T37: of:=[.T19]/2+[.T16]+[.T17]/2+[.T14]+[.T21] -> 5 | U37: of:=[.U19]/2+[.U16]+[.U17]/2+[.U14]+[.U21] -> 6 | V37: of:=[.V19]/2+[.V16]+[.V17]/2+[.V14]+[.V21] -> 6 | W37: of:=[.W19]/2+[.W16]+[.W17]/2+[.W14]+[.W21] -> 6 | X37: of:=[.X19]/2+[.X16]+[.X17]/2+[.X14]+[.X21] -> 6 | Y37: of:=[.Y19]/2+[.Y16]+[.Y17]/2+[.Y14]+[.Y21] -> 6 | Z37: of:=[.Z19]/2+[.Z16]+[.Z17]/2+[.Z14]+[.Z21] -> 6 | AA37: of:=[.AA19]/2+[.AA16]+[.AA17]/2+[.AA14]+[.AA21] -> 6 | AB37: of:=[.AB19]/2+[.AB16]+[.AB17]/2+[.AB14]+[.AB21] -> 6 | AC37: of:=[.AC19]/2+[.AC16]+[.AC17]/2+[.AC14]+[.AC21] -> 6 | AD37: of:=[.AD19]/2+[.AD16]+[.AD17]/2+[.AD14]+[.AD21] -> 6 | AE37: of:=[.AE19]/2+[.AE16]+[.AE17]/2+[.AE14]+[.AE21] -> 5 | AF37: of:=[.AF19]/2+[.AF16]+[.AF17]/2+[.AF14]+[.AF21] -> 6 | AG37: of:=[.AG19]/2+[.AG16]+[.AG17]/2+[.AG14]+[.AG21] -> 0 | AH37: of:=[.AH19]/2+[.AH16]+[.AH17]/2+[.AH14]+[.AH21] -> 5 | AI37: of:=[.AI19]/2+[.AI16]+[.AI17]/2+[.AI14]+[.AI21] -> 6 | AJ37: of:=[.AJ19]/2+[.AJ16]+[.AJ17]/2+[.AJ14]+[.AJ21] -> 6 | AK37: of:=[.AK19]/2+[.AK16]+[.AK17]/2+[.AK14]+[.AK21] -> 6 | AL37: of:=[.AL19]/2+[.AL16]+[.AL17]/2+[.AL14]+[.AL21] -> 5 | AM37: of:=[.AM19]/2+[.AM16]+[.AM17]/2+[.AM14]+[.AM21] -> 0 | AN37: of:=[.AN19]/2+[.AN16]+[.AN17]/2+[.AN14]+[.AN21] -> 6 | AO37: of:=[.AO19]/2+[.AO16]+[.AO17]/2+[.AO14]+[.AO21] -> 6 | AP37: of:=[.AP19]/2+[.AP16]+[.AP17]/2+[.AP14]+[.AP21] -> 6 | AQ37: of:=[.AQ19]/2+[.AQ16]+[.AQ17]/2+[.AQ14]+[.AQ21] -> 6 | AR37: of:=[.AR19]/2+[.AR16]+[.AR17]/2+[.AR14]+[.AR21] -> 6 | AS37: of:=[.AS19]/2+[.AS16]+[.AS17]/2+[.AS14]+[.AS21] -> 6 | AT37: of:=[.AT19]/2+[.AT16]+[.AT17]/2+[.AT14]+[.AT21] -> 6 | AU37: of:=[.AU19]/2+[.AU16]+[.AU17]/2+[.AU14]+[.AU21] -> 6 | AV37: of:=[.AV19]/2+[.AV16]+[.AV17]/2+[.AV14]+[.AV21] -> 6 | AW37: of:=[.AW19]/2+[.AW16]+[.AW17]/2+[.AW14]+[.AW21] -> 6 | AX37: of:=[.AX19]/2+[.AX16]+[.AX17]/2+[.AX14]+[.AX21] -> 6 | AY37: of:=[.AY19]/2+[.AY16]+[.AY17]/2+[.AY14]+[.AY21] -> 5
A38: Capture screen | B38: 0 | C38: 0 | D38: 0 | E38: 0 | F38: 0 | G38: 0 | H38: 0 | I38: 0 | J38: 0 | K38: 0 | L38: 0 | M38: 0 | N38: 0 | O38: 0 | P38: 0 | Q38: 0 | R38: 0 | S38: 0 | T38: 0 | U38: 0 | V38: 0 | W38: 0 | X38: 0 | Y38: 0 | Z38: 0 | AA38: 0 | AB38: 0 | AC38: 0 | AD38: 0 | AE38: 0 | AF38: 0 | AG38: 0 | AH38: 0 | AI38: 0 | AJ38: 0 | AK38: 0 | AL38: 0 | AM38: 0 | AN38: 0 | AO38: 0 | AP38: 0 | AQ38: 0 | AR38: 0 | AS38: 0 | AT38: 0 | AU38: 0 | AV38: 0 | AW38: 0 | AX38: 0 | AY38: 0
A39: Collect cached credentials with elevated privileges | B39: of:=[.B10] -> 1 | C39: of:=[.C10] -> 1 | D39: of:=[.D10] -> 1 | E39: of:=[.E10] -> 1 | F39: of:=[.F10] -> 0 | G39: of:=[.G10] -> 1 | H39: of:=[.H10] -> 1 | I39: of:=[.I10] -> 1 | J39: of:=[.J10] -> 0 | K39: of:=[.K10] -> 0 | L39: of:=[.L10] -> 0 | M39: of:=[.M10] -> 1 | N39: of:=[.N10] -> 1 | O39: of:=[.O10] -> 1 | P39: of:=[.P10] -> 1 | Q39: of:=[.Q10] -> 1 | R39: of:=[.R10] -> 1 | S39: of:=[.S10] -> 1 | T39: of:=[.T10] -> 1 | U39: of:=[.U10] -> 1 | V39: of:=[.V10] -> 1 | W39: of:=[.W10] -> 1 | X39: of:=[.X10] -> 1 | Y39: of:=[.Y10] -> 1 | Z39: of:=[.Z10] -> 1 | AA39: of:=[.AA10] -> 1 | AB39: of:=[.AB10] -> 1 | AC39: of:=[.AC10] -> 1 | AD39: of:=[.AD10] -> 0 | AE39: of:=[.AE10] -> 0 | AF39: of:=[.AF10] -> 0 | AG39: of:=[.AG10] -> 0 | AH39: of:=[.AH10] -> 0 | AI39: of:=[.AI10] -> 0 | AJ39: of:=[.AJ10] -> 0 | AK39: of:=[.AK10] -> 0 | AL39: of:=[.AL10] -> 0 | AM39: of:=[.AM10] -> 0 | AN39: of:=[.AN10] -> 0 | AO39: of:=[.AO10] -> 0 | AP39: of:=[.AP10] -> 0 | AQ39: of:=[.AQ10] -> 0 | AR39: of:=[.AR10] -> 0 | AS39: of:=[.AS10] -> 0 | AT39: of:=[.AT10] -> 0 | AU39: of:=[.AU10] -> 0 | AV39: of:=[.AV10] -> 0 | AW39: of:=[.AW10] -> 0 | AX39: of:=[.AX10] -> 0 | AY39: of:=[.AY10] -> 0
A40: Search network and download files | B40: 0 | C40: 0 | D40: 0 | E40: 0 | F40: 0 | G40: 0 | H40: 0 | I40: 0 | J40: 0 | K40: 0 | L40: 0 | M40: 0 | N40: 0 | O40: 0 | P40: 0 | Q40: 0 | R40: 0 | S40: 0 | T40: 0 | U40: 0 | V40: 0 | W40: 0 | X40: 0 | Y40: 0 | Z40: 0 | AA40: 0 | AB40: 0 | AC40: 0 | AD40: 0 | AE40: 0 | AF40: 0 | AG40: 0 | AH40: 0 | AI40: 0 | AJ40: 0 | AK40: 0 | AL40: 0 | AM40: 0 | AN40: 0 | AO40: 0 | AP40: 0 | AQ40: 0 | AR40: 0 | AS40: 0 | AT40: 0 | AU40: 0 | AV40: 0 | AW40: 0 | AX40: 0 | AY40: 0
A41: Download custom backdoor | B41: of:=[.B15]+[.B19]/2+[.B17]/2+[.B12]+[.B11] -> 7 | C41: of:=[.C15]+[.C19]/2+[.C17]/2+[.C12]+[.C11] -> 7 | D41: of:=[.D15]+[.D19]/2+[.D17]/2+[.D12]+[.D11] -> 7 | E41: of:=[.E15]+[.E19]/2+[.E17]/2+[.E12]+[.E11] -> 7 | F41: of:=[.F15]+[.F19]/2+[.F17]/2+[.F12]+[.F11] -> 4 | G41: of:=[.G15]+[.G19]/2+[.G17]/2+[.G12]+[.G11] -> 7 | H41: of:=[.H15]+[.H19]/2+[.H17]/2+[.H12]+[.H11] -> 7 | I41: of:=[.I15]+[.I19]/2+[.I17]/2+[.I12]+[.I11] -> 7 | J41: of:=[.J15]+[.J19]/2+[.J17]/2+[.J12]+[.J11] -> 4 | K41: of:=[.K15]+[.K19]/2+[.K17]/2+[.K12]+[.K11] -> 0 | L41: of:=[.L15]+[.L19]/2+[.L17]/2+[.L12]+[.L11] -> 4 | M41: of:=[.M15]+[.M19]/2+[.M17]/2+[.M12]+[.M11] -> 7 | N41: of:=[.N15]+[.N19]/2+[.N17]/2+[.N12]+[.N11] -> 7 | O41: of:=[.O15]+[.O19]/2+[.O17]/2+[.O12]+[.O11] -> 7 | P41: of:=[.P15]+[.P19]/2+[.P17]/2+[.P12]+[.P11] -> 7 | Q41: of:=[.Q15]+[.Q19]/2+[.Q17]/2+[.Q12]+[.Q11] -> 7 | R41: of:=[.R15]+[.R19]/2+[.R17]/2+[.R12]+[.R11] -> 7 | S41: of:=[.S15]+[.S19]/2+[.S17]/2+[.S12]+[.S11] -> 7 | T41: of:=[.T15]+[.T19]/2+[.T17]/2+[.T12]+[.T11] -> 7 | U41: of:=[.U15]+[.U19]/2+[.U17]/2+[.U12]+[.U11] -> 7 | V41: of:=[.V15]+[.V19]/2+[.V17]/2+[.V12]+[.V11] -> 7 | W41: of:=[.W15]+[.W19]/2+[.W17]/2+[.W12]+[.W11] -> 7 | X41: of:=[.X15]+[.X19]/2+[.X17]/2+[.X12]+[.X11] -> 7 | Y41: of:=[.Y15]+[.Y19]/2+[.Y17]/2+[.Y12]+[.Y11] -> 7 | Z41: of:=[.Z15]+[.Z19]/2+[.Z17]/2+[.Z12]+[.Z11] -> 7 | AA41: of:=[.AA15]+[.AA19]/2+[.AA17]/2+[.AA12]+[.AA11] -> 7 | AB41: of:=[.AB15]+[.AB19]/2+[.AB17]/2+[.AB12]+[.AB11] -> 7 | AC41: of:=[.AC15]+[.AC19]/2+[.AC17]/2+[.AC12]+[.AC11] -> 7 | AD41: of:=[.AD15]+[.AD19]/2+[.AD17]/2+[.AD12]+[.AD11] -> 3 | AE41: of:=[.AE15]+[.AE19]/2+[.AE17]/2+[.AE12]+[.AE11] -> 3 | AF41: of:=[.AF15]+[.AF19]/2+[.AF17]/2+[.AF12]+[.AF11] -> 3 | AG41: of:=[.AG15]+[.AG19]/2+[.AG17]/2+[.AG12]+[.AG11] -> 0 | AH41: of:=[.AH15]+[.AH19]/2+[.AH17]/2+[.AH12]+[.AH11] -> 3 | AI41: of:=[.AI15]+[.AI19]/2+[.AI17]/2+[.AI12]+[.AI11] -> 3 | AJ41: of:=[.AJ15]+[.AJ19]/2+[.AJ17]/2+[.AJ12]+[.AJ11] -> 3 | AK41: of:=[.AK15]+[.AK19]/2+[.AK17]/2+[.AK12]+[.AK11] -> 3 | AL41: of:=[.AL15]+[.AL19]/2+[.AL17]/2+[.AL12]+[.AL11] -> 3 | AM41: of:=[.AM15]+[.AM19]/2+[.AM17]/2+[.AM12]+[.AM11] -> 0 | AN41: of:=[.AN15]+[.AN19]/2+[.AN17]/2+[.AN12]+[.AN11] -> 3 | AO41: of:=[.AO15]+[.AO19]/2+[.AO17]/2+[.AO12]+[.AO11] -> 3 | AP41: of:=[.AP15]+[.AP19]/2+[.AP17]/2+[.AP12]+[.AP11] -> 3 | AQ41: of:=[.AQ15]+[.AQ19]/2+[.AQ17]/2+[.AQ12]+[.AQ11] -> 3 | AR41: of:=[.AR15]+[.AR19]/2+[.AR17]/2+[.AR12]+[.AR11] -> 3 | AS41: of:=[.AS15]+[.AS19]/2+[.AS17]/2+[.AS12]+[.AS11] -> 3 | AT41: of:=[.AT15]+[.AT19]/2+[.AT17]/2+[.AT12]+[.AT11] -> 3 | AU41: of:=[.AU15]+[.AU19]/2+[.AU17]/2+[.AU12]+[.AU11] -> 3 | AV41: of:=[.AV15]+[.AV19]/2+[.AV17]/2+[.AV12]+[.AV11] -> 3 | AW41: of:=[.AW15]+[.AW19]/2+[.AW17]/2+[.AW12]+[.AW11] -> 3 | AX41: of:=[.AX15]+[.AX19]/2+[.AX17]/2+[.AX12]+[.AX11] -> 3 | AY41: of:=[.AY15]+[.AY19]/2+[.AY17]/2+[.AY12]+[.AY11] -> 3
A42: Set autostart for custom backdoor | B42: of:=[.B9]+[.B8] -> 2 | C42: of:=[.C9]+[.C8] -> 2 | D42: of:=[.D9]+[.D8] -> 2 | E42: of:=[.E9]+[.E8] -> 2 | F42: of:=[.F9]+[.F8] -> 2 | G42: of:=[.G9]+[.G8] -> 2 | H42: of:=[.H9]+[.H8] -> 2 | I42: of:=[.I9]+[.I8] -> 2 | J42: of:=[.J9]+[.J8] -> 2 | K42: of:=[.K9]+[.K8] -> 0 | L42: of:=[.L9]+[.L8] -> 2 | M42: of:=[.M9]+[.M8] -> 2 | N42: of:=[.N9]+[.N8] -> 2 | O42: of:=[.O9]+[.O8] -> 2 | P42: of:=[.P9]+[.P8] -> 2 | Q42: of:=[.Q9]+[.Q8] -> 2 | R42: of:=[.R9]+[.R8] -> 2 | S42: of:=[.S9]+[.S8] -> 2 | T42: of:=[.T9]+[.T8] -> 2 | U42: of:=[.U9]+[.U8] -> 2 | V42: of:=[.V9]+[.V8] -> 2 | W42: of:=[.W9]+[.W8] -> 2 | X42: of:=[.X9]+[.X8] -> 2 | Y42: of:=[.Y9]+[.Y8] -> 2 | Z42: of:=[.Z9]+[.Z8] -> 2 | AA42: of:=[.AA9]+[.AA8] -> 2 | AB42: of:=[.AB9]+[.AB8] -> 2 | AC42: of:=[.AC9]+[.AC8] -> 2 | AD42: of:=[.AD9]+[.AD8] -> 0 | AE42: of:=[.AE9]+[.AE8] -> 0 | AF42: of:=[.AF9]+[.AF8] -> 0 | AG42: of:=[.AG9]+[.AG8] -> 0 | AH42: of:=[.AH9]+[.AH8] -> 0 | AI42: of:=[.AI9]+[.AI8] -> 0 | AJ42: of:=[.AJ9]+[.AJ8] -> 0 | AK42: of:=[.AK9]+[.AK8] -> 0 | AL42: of:=[.AL9]+[.AL8] -> 0 | AM42: of:=[.AM9]+[.AM8] -> 0 | AN42: of:=[.AN9]+[.AN8] -> 0 | AO42: of:=[.AO9]+[.AO8] -> 0 | AP42: of:=[.AP9]+[.AP8] -> 0 | AQ42: of:=[.AQ9]+[.AQ8] -> 0 | AR42: of:=[.AR9]+[.AR8] -> 0 | AS42: of:=[.AS9]+[.AS8] -> 0 | AT42: of:=[.AT9]+[.AT8] -> 0 | AU42: of:=[.AU9]+[.AU8] -> 0 | AV42: of:=[.AV9]+[.AV8] -> 0 | AW42: of:=[.AW9]+[.AW8] -> 0 | AX42: of:=[.AX9]+[.AX8] -> 0 | AY42: of:=[.AY9]+[.AY8] -> 0
A43: Execute custom backdoor | B43: 0 | C43: 0 | D43: 0 | E43: 0 | F43: 0 | G43: 0 | H43: 0 | I43: 0 | J43: 0 | K43: 0 | L43: 0 | M43: 0 | N43: 0 | O43: 0 | P43: 0 | Q43: 0 | R43: 0 | S43: 0 | T43: 0 | U43: 0 | V43: 0 | W43: 0 | X43: 0 | Y43: 0 | Z43: 0 | AA43: 0 | AB43: 0 | AC43: 0 | AD43: 0 | AE43: 0 | AF43: 0 | AG43: 0 | AH43: 0 | AI43: 0 | AJ43: 0 | AK43: 0 | AL43: 0 | AM43: 0 | AN43: 0 | AO43: 0 | AP43: 0 | AQ43: 0 | AR43: 0 | AS43: 0 | AT43: 0 | AU43: 0 | AV43: 0 | AW43: 0 | AX43: 0 | AY43: 0
A45: Sum | B45: of:=SUM([.B35:.B43]) -> 142 | C45: of:=SUM([.C35:.C43]) -> 142 | D45: of:=SUM([.D35:.D43]) -> 143 | E45: of:=SUM([.E35:.E43]) -> 138 | F45: of:=SUM([.F35:.F43]) -> 6 | G45: of:=SUM([.G35:.G43]) -> 143 | H45: of:=SUM([.H35:.H43]) -> 141 | I45: of:=SUM([.I35:.I43]) -> 142 | J45: of:=SUM([.J35:.J43]) -> 6 | K45: of:=SUM([.K35:.K43]) -> 0 | L45: of:=SUM([.L35:.L43]) -> 6 | M45: of:=SUM([.M35:.M43]) -> 142 | N45: of:=SUM([.N35:.N43]) -> 142 | O45: of:=SUM([.O35:.O43]) -> 143 | P45: of:=SUM([.P35:.P43]) -> 142 | Q45: of:=SUM([.Q35:.Q43]) -> 142 | R45: of:=SUM([.R35:.R43]) -> 143 | S45: of:=SUM([.S35:.S43]) -> 142 | T45: of:=SUM([.T35:.T43]) -> 142 | U45: of:=SUM([.U35:.U43]) -> 142 | V45: of:=SUM([.V35:.V43]) -> 143 | W45: of:=SUM([.W35:.W43]) -> 142 | X45: of:=SUM([.X35:.X43]) -> 142 | Y45: of:=SUM([.Y35:.Y43]) -> 143 | Z45: of:=SUM([.Z35:.Z43]) -> 142 | AA45: of:=SUM([.AA35:.AA43]) -> 142 | AB45: of:=SUM([.AB35:.AB43]) -> 144 | AC45: of:=SUM([.AC35:.AC43]) -> 142 | AD45: of:=SUM([.AD35:.AD43]) -> 137 | AE45: of:=SUM([.AE35:.AE43]) -> 134 | AF45: of:=SUM([.AF35:.AF43]) -> 136 | AG45: of:=SUM([.AG35:.AG43]) -> 0 | AH45: of:=SUM([.AH35:.AH43]) -> 134 | AI45: of:=SUM([.AI35:.AI43]) -> 135 | AJ45: of:=SUM([.AJ35:.AJ43]) -> 135 | AK45: of:=SUM([.AK35:.AK43]) -> 135 | AL45: of:=SUM([.AL35:.AL43]) -> 134 | AM45: of:=SUM([.AM35:.AM43]) -> 0 | AN45: of:=SUM([.AN35:.AN43]) -> 136 | AO45: of:=SUM([.AO35:.AO43]) -> 135 | AP45: of:=SUM([.AP35:.AP43]) -> 137 | AQ45: of:=SUM([.AQ35:.AQ43]) -> 135 | AR45: of:=SUM([.AR35:.AR43]) -> 136 | AS45: of:=SUM([.AS35:.AS43]) -> 135 | AT45: of:=SUM([.AT35:.AT43]) -> 136 | AU45: of:=SUM([.AU35:.AU43]) -> 135 | AV45: of:=SUM([.AV35:.AV43]) -> 136 | AW45: of:=SUM([.AW35:.AW43]) -> 135 | AX45: of:=SUM([.AX35:.AX43]) -> 136 | AY45: of:=SUM([.AY35:.AY43]) -> 134
A46: Number of detected attack steps | B46: of:=COUNTIF([.B35:.B43];">0") -> 6 | C46: of:=COUNTIF([.C35:.C43];">0") -> 6 | D46: of:=COUNTIF([.D35:.D43];">0") -> 6 | E46: of:=COUNTIF([.E35:.E43];">0") -> 6 | F46: of:=COUNTIF([.F35:.F43];">0") -> 2 | G46: of:=COUNTIF([.G35:.G43];">0") -> 6 | H46: of:=COUNTIF([.H35:.H43];">0") -> 6 | I46: of:=COUNTIF([.I35:.I43];">0") -> 6 | J46: of:=COUNTIF([.J35:.J43];">0") -> 2 | K46: of:=COUNTIF([.K35:.K43];">0") -> 0 | L46: of:=COUNTIF([.L35:.L43];">0") -> 2 | M46: of:=COUNTIF([.M35:.M43];">0") -> 6 | N46: of:=COUNTIF([.N35:.N43];">0") -> 6 | O46: of:=COUNTIF([.O35:.O43];">0") -> 6 | P46: of:=COUNTIF([.P35:.P43];">0") -> 6 | Q46: of:=COUNTIF([.Q35:.Q43];">0") -> 6 | R46: of:=COUNTIF([.R35:.R43];">0") -> 6 | S46: of:=COUNTIF([.S35:.S43];">0") -> 6 | T46: of:=COUNTIF([.T35:.T43];">0") -> 6 | U46: of:=COUNTIF([.U35:.U43];">0") -> 6 | V46: of:=COUNTIF([.V35:.V43];">0") -> 6 | W46: of:=COUNTIF([.W35:.W43];">0") -> 6 | X46: of:=COUNTIF([.X35:.X43];">0") -> 6 | Y46: of:=COUNTIF([.Y35:.Y43];">0") -> 6 | Z46: of:=COUNTIF([.Z35:.Z43];">0") -> 6 | AA46: of:=COUNTIF([.AA35:.AA43];">0") -> 6 | AB46: of:=COUNTIF([.AB35:.AB43];">0") -> 6 | AC46: of:=COUNTIF([.AC35:.AC43];">0") -> 6 | AD46: of:=COUNTIF([.AD35:.AD43];">0") -> 4 | AE46: of:=COUNTIF([.AE35:.AE43];">0") -> 4 | AF46: of:=COUNTIF([.AF35:.AF43];">0") -> 4 | AG46: of:=COUNTIF([.AG35:.AG43];">0") -> 0 | AH46: of:=COUNTIF([.AH35:.AH43];">0") -> 4 | AI46: of:=COUNTIF([.AI35:.AI43];">0") -> 4 | AJ46: of:=COUNTIF([.AJ35:.AJ43];">0") -> 4 | AK46: of:=COUNTIF([.AK35:.AK43];">0") -> 4 | AL46: of:=COUNTIF([.AL35:.AL43];">0") -> 4 | AM46: of:=COUNTIF([.AM35:.AM43];">0") -> 0 | AN46: of:=COUNTIF([.AN35:.AN43];">0") -> 4 | AO46: of:=COUNTIF([.AO35:.AO43];">0") -> 4 | AP46: of:=COUNTIF([.AP35:.AP43];">0") -> 4 | AQ46: of:=COUNTIF([.AQ35:.AQ43];">0") -> 4 | AR46: of:=COUNTIF([.AR35:.AR43];">0") -> 4 | AS46: of:=COUNTIF([.AS35:.AS43];">0") -> 4 | AT46: of:=COUNTIF([.AT35:.AT43];">0") -> 4 | AU46: of:=COUNTIF([.AU35:.AU43];">0") -> 4 | AV46: of:=COUNTIF([.AV35:.AV43];">0") -> 4 | AW46: of:=COUNTIF([.AW35:.AW43];">0") -> 4 | AX46: of:=COUNTIF([.AX35:.AX43];">0") -> 4 | AY46: of:=COUNTIF([.AY35:.AY43];">0") -> 4
A47: First valid ten runs (used for evaluation) | B47: ☻ | C47: ☻ | D47: ☻ | E47: ☻ | G47: ☻ | H47: ☻ | I47: ☻ | M47: ☻ | N47: ☻ | O47: ☻ | Q47: ☻ | R47: ☻ | S47: ☻ | T47: ☻ | U47: ☻ | V47: ☻ | W47: ☻ | X47: ☻ | Y47: ☻ | Z47: ☻ | AD47: ☻ | AE47: ☻ | AF47: ☻ | AH47: ☻ | AI47: ☻ | AJ47: ☻ | AK47: ☻ | AL47: ☻ | AN47: ☻ | AO47: ☻ | AP47: ☻ | AQ47: ☻ | AR47: ☻ | AS47: ☻ | AT47: ☻ | AU47: ☻ | AV47: ☻ | AW47: ☻ | AX47: ☻ | AY47: ☻
B49: Complete! | Q49: Complete! | AD49: Complete! | AP49: Complete!

Sheet: Iterations Used for Evaluation
A1: Data source
A2: Dataset | B2: host1 | L2: host1 | V2: host1 | AF2: host2 | AP2: host1 | AT2: host2
A3: Windows logging configuration | B3: default | L3: best practice | V3: default | AF3: best practice | AP3: default | AR3: best practice | AT3: default | AV3: best practice
A4: Iteration | B4: 1 | C4: 2 | D4: 3 | E4: 5 | F4: 1 | G4: 2 | H4: 3 | I4: 4 | J4: 6 | K4: 1 | L4: 1 | M4: 2 | N4: 3 | O4: 4 | P4: 1 | Q4: 2 | R4: 3 | S4: 7 | T4: 8 | U4: 9 | V4: 1 | W4: 2 | X4: 3 | Y4: 4 | Z4: 5 | AA4: 6 | AB4: 7 | AC4: 8 | AD4: 1 | AE4: 2 | AF4: 1 | AG4: 2 | AH4: 3 | AI4: 4 | AJ4: 5 | AK4: 1 | AL4: 2 | AM4: 3 | AN4: 4 | AO4: 5 | AP4: Mean | AQ4: SD | AR4: Mean | AS4: SD | AT4: Mean | AU4: SD | AV4: Mean | AW4: SD
A5: No errors in simulations.log? Cat simulations.log | B5: ✓ | C5: ✓ | D5: ✓ | E5: ✓ | F5: ✓ | G5: ✓ | H5: ✓ | I5: ✓ | J5: ✓ | K5: ✓ | L5: ✓ | M5: ✓ | N5: ✓ | O5: ✓ | P5: ✓ | Q5: ✓ | R5: ✓ | S5: ✓ | T5: ✓ | U5: ✓ | V5: ✓ | W5: ✓ | X5: ✓ | Y5: ✓ | Z5: ✓ | AA5: ✓ | AB5: ✓ | AC5: ✓ | AD5: ✓ | AE5: ✓ | AF5: ✓ | AG5: ✓ | AH5: ✓ | AI5: ✓ | AJ5: ✓ | AK5: ✓ | AL5: ✓ | AM5: ✓ | AN5: ✓ | AO5: ✓
A6: All attacks successful? Grep attack_succeeded attackconsole_*.log | wc -l | B6: ✓ | C6: ✓ | D6: ✓ | E6: ✓ | F6: ✓ | G6: ✓ | H6: ✓ | I6: ✓ | J6: ✓ | K6: ✓ | L6: ✓ | M6: ✓ | N6: ✓ | O6: ✓ | P6: ✓ | Q6: ✓ | R6: ✓ | S6: ✓ | T6: ✓ | U6: ✓ | V6: ✓ | W6: ✓ | X6: ✓ | Y6: ✓ | Z6: ✓ | AA6: ✓ | AB6: ✓ | AC6: ✓ | AD6: ✓ | AE6: ✓ | AF6: ✓ | AG6: ✓ | AH6: ✓ | AI6: ✓ | AJ6: ✓ | AK6: ✓ | AL6: ✓ | AM6: ✓ | AN6: ✓ | AO6: ✓
A7: Sigma for i in {1..5}; count_tps_sigma.py sigma_$i.jsonl
A8: Autorun Keys Modification | B8: 0 | C8: 0 | D8: 0 | E8: 0 | F8: 0 | G8: 0 | H8: 0 | I8: 0 | J8: 0 | K8: 0 | L8: 1 | M8: 1 | N8: 1 | O8: 1 | P8: 1 | Q8: 1 | R8: 1 | S8: 1 | T8: 1 | U8: 1 | V8: 0 | W8: 0 | X8: 0 | Y8: 0 | Z8: 0 | AA8: 0 | AB8: 0 | AC8: 0 | AD8: 0 | AE8: 0 | AF8: 1 | AG8: 1 | AH8: 1 | AI8: 1 | AJ8: 1 | AK8: 1 | AL8: 1 | AM8: 1 | AN8: 1 | AO8: 1 | AP8: of:=AVERAGE([.B8:.K8]) -> 0 | AQ8: of:=STDEV([.B8:.K8]) -> 0 | AR8: of:=AVERAGE([.L8:.U8]) -> 1 | AS8: of:=STDEV([.L8:.U8]) -> 0 | AT8: of:=AVERAGE([.V8:.AE8]) -> 0 | AU8: of:=STDEV([.V8:.AE8]) -> 0 | AV8: of:=AVERAGE([.AF8:.AO8]) -> 1 | AW8: of:=STDEV([.AF8:.AO8]) -> 0
A9: Direct Autorun Keys Modification | B9: 0 | C9: 0 | D9: 0 | E9: 0 | F9: 0 | G9: 0 | H9: 0 | I9: 0 | J9: 0 | K9: 0 | L9: 1 | M9: 1 | N9: 1 | O9: 1 | P9: 1 | Q9: 1 | R9: 1 | S9: 1 | T9: 1 | U9: 1 | V9: 0 | W9: 0 | X9: 0 | Y9: 0 | Z9: 0 | AA9: 0 | AB9: 0 | AC9: 0 | AD9: 0 | AE9: 0 | AF9: 1 | AG9: 1 | AH9: 1 | AI9: 1 | AJ9: 1 | AK9: 1 | AL9: 1 | AM9: 1 | AN9: 1 | AO9: 1 | AP9: of:=AVERAGE([.B9:.K9]) -> 0 | AQ9: of:=STDEV([.B9:.K9]) -> 0 | AR9: of:=AVERAGE([.L9:.U9]) -> 1 | AS9: of:=STDEV([.L9:.U9]) -> 0 | AT9: of:=AVERAGE([.V9:.AE9]) -> 0 | AU9: of:=STDEV([.V9:.AE9]) -> 0 | AV9: of:=AVERAGE([.AF9:.AO9]) -> 1 | AW9: of:=STDEV([.AF9:.AO9]) -> 0
A10: Meterpreter or Cobalt Strike Getsystem Service Start | B10: 0 | C10: 0 | D10: 0 | E10: 0 | F10: 0 | G10: 0 | H10: 0 | I10: 0 | J10: 0 | K10: 0 | L10: 1 | M10: 1 | N10: 1 | O10: 1 | P10: 1 | Q10: 1 | R10: 1 | S10: 1 | T10: 1 | U10: 1 | V10: 0 | W10: 0 | X10: 0 | Y10: 0 | Z10: 0 | AA10: 0 | AB10: 0 | AC10: 0 | AD10: 0 | AE10: 0 | AF10: 1 | AG10: 1 | AH10: 1 | AI10: 1 | AJ10: 1 | AK10: 1 | AL10: 1 | AM10: 1 | AN10: 1 | AO10: 1 | AP10: of:=AVERAGE([.B10:.K10]) -> 0 | AQ10: of:=STDEV([.B10:.K10]) -> 0 | AR10: of:=AVERAGE([.L10:.U10]) -> 1 | AS10: of:=STDEV([.L10:.U10]) -> 0 | AT10: of:=AVERAGE([.V10:.AE10]) -> 0 | AU10: of:=STDEV([.V10:.AE10]) -> 0 | AV10: of:=AVERAGE([.AF10:.AO10]) -> 1 | AW10: of:=STDEV([.AF10:.AO10]) -> 0
A11: Non Interactive PowerShell | B11: 0 | C11: 0 | D11: 0 | E11: 0 | F11: 0 | G11: 0 | H11: 0 | I11: 0 | J11: 0 | K11: 0 | L11: 1 | M11: 1 | N11: 1 | O11: 1 | P11: 1 | Q11: 1 | R11: 1 | S11: 1 | T11: 1 | U11: 1 | V11: 0 | W11: 0 | X11: 0 | Y11: 0 | Z11: 0 | AA11: 0 | AB11: 0 | AC11: 0 | AD11: 0 | AE11: 0 | AF11: 1 | AG11: 1 | AH11: 1 | AI11: 1 | AJ11: 1 | AK11: 1 | AL11: 1 | AM11: 1 | AN11: 1 | AO11: 1 | AP11: of:=AVERAGE([.B11:.K11]) -> 0 | AQ11: of:=STDEV([.B11:.K11]) -> 0 | AR11: of:=AVERAGE([.L11:.U11]) -> 1 | AS11: of:=STDEV([.L11:.U11]) -> 0 | AT11: of:=AVERAGE([.V11:.AE11]) -> 0 | AU11: of:=STDEV([.V11:.AE11]) -> 0 | AV11: of:=AVERAGE([.AF11:.AO11]) -> 1 | AW11: of:=STDEV([.AF11:.AO11]) -> 0
A12: Windows PowerShell Web Request | B12: 0 | C12: 0 | D12: 0 | E12: 0 | F12: 0 | G12: 0 | H12: 0 | I12: 0 | J12: 0 | K12: 0 | L12: 3 | M12: 3 | N12: 3 | O12: 3 | P12: 3 | Q12: 3 | R12: 3 | S12: 3 | T12: 3 | U12: 3 | V12: 0 | W12: 0 | X12: 0 | Y12: 0 | Z12: 0 | AA12: 0 | AB12: 0 | AC12: 0 | AD12: 0 | AE12: 0 | AF12: 3 | AG12: 3 | AH12: 3 | AI12: 3 | AJ12: 3 | AK12: 3 | AL12: 3 | AM12: 3 | AN12: 3 | AO12: 3 | AP12: of:=AVERAGE([.B12:.K12]) -> 0 | AQ12: of:=STDEV([.B12:.K12]) -> 0 | AR12: of:=AVERAGE([.L12:.U12]) -> 3 | AS12: of:=STDEV([.L12:.U12]) -> 0 | AT12: of:=AVERAGE([.V12:.AE12]) -> 0 | AU12: of:=STDEV([.V12:.AE12]) -> 0 | AV12: of:=AVERAGE([.AF12:.AO12]) -> 3 | AW12: of:=STDEV([.AF12:.AO12]) -> 0
A13: Suricata for i in {1..5}; python3 ../../count_tps_suricata.py syslog_$i.jsonl
A14: ET INFO EXE IsDebuggerPresent (Used in Malware Anti-Debugging) | B14: 1 | C14: 1 | D14: 1 | E14: 1 | F14: 1 | G14: 1 | H14: 1 | I14: 1 | J14: 1 | K14: 1 | L14: 1 | M14: 1 | N14: 1 | O14: 1 | P14: 1 | Q14: 1 | R14: 1 | S14: 1 | T14: 1 | U14: 1 | V14: 1 | W14: 1 | X14: 1 | Y14: 1 | Z14: 1 | AA14: 1 | AB14: 1 | AC14: 1 | AD14: 1 | AE14: 1 | AF14: 1 | AG14: 1 | AH14: 1 | AI14: 1 | AJ14: 1 | AK14: 1 | AL14: 1 | AM14: 1 | AN14: 1 | AO14: 1 | AP14: of:=AVERAGE([.B14:.K14]) -> 1 | AQ14: of:=STDEV([.B14:.K14]) -> 0 | AR14: of:=AVERAGE([.L14:.U14]) -> 1 | AS14: of:=STDEV([.L14:.U14]) -> 0 | AT14: of:=AVERAGE([.V14:.AE14]) -> 1 | AU14: of:=STDEV([.V14:.AE14]) -> 0 | AV14: of:=AVERAGE([.AF14:.AO14]) -> 1 | AW14: of:=STDEV([.AF14:.AO14]) -> 0
A15: ET INFO Executable Download from dotted-quad Host | B15: 1 | C15: 1 | D15: 1 | E15: 1 | F15: 1 | G15: 1 | H15: 1 | I15: 1 | J15: 1 | K15: 1 | L15: 1 | M15: 1 | N15: 1 | O15: 1 | P15: 1 | Q15: 1 | R15: 1 | S15: 1 | T15: 1 | U15: 1 | V15: 1 | W15: 1 | X15: 1 | Y15: 1 | Z15: 1 | AA15: 1 | AB15: 1 | AC15: 1 | AD15: 1 | AE15: 1 | AF15: 1 | AG15: 1 | AH15: 1 | AI15: 1 | AJ15: 1 | AK15: 1 | AL15: 1 | AM15: 1 | AN15: 1 | AO15: 1 | AP15: of:=AVERAGE([.B15:.K15]) -> 1 | AQ15: of:=STDEV([.B15:.K15]) -> 0 | AR15: of:=AVERAGE([.L15:.U15]) -> 1 | AS15: of:=STDEV([.L15:.U15]) -> 0 | AT15: of:=AVERAGE([.V15:.AE15]) -> 1 | AU15: of:=STDEV([.V15:.AE15]) -> 0 | AV15: of:=AVERAGE([.AF15:.AO15]) -> 1 | AW15: of:=STDEV([.AF15:.AO15]) -> 0
A16: ET INFO Executable Retrieved With Minimal HTTP Headers - Potential Second Stage Download | B16: 1 | C16: 1 | D16: 1 | E16: 1 | F16: 1 | G16: 1 | H16: 1 | I16: 1 | J16: 1 | K16: 1 | L16: 1 | M16: 1 | N16: 1 | O16: 1 | P16: 1 | Q16: 1 | R16: 1 | S16: 1 | T16: 1 | U16: 1 | V16: 1 | W16: 1 | X16: 1 | Y16: 1 | Z16: 1 | AA16: 1 | AB16: 1 | AC16: 1 | AD16: 1 | AE16: 1 | AF16: 1 | AG16: 1 | AH16: 1 | AI16: 1 | AJ16: 1 | AK16: 1 | AL16: 1 | AM16: 1 | AN16: 1 | AO16: 1 | AP16: of:=AVERAGE([.B16:.K16]) -> 1 | AQ16: of:=STDEV([.B16:.K16]) -> 0 | AR16: of:=AVERAGE([.L16:.U16]) -> 1 | AS16: of:=STDEV([.L16:.U16]) -> 0 | AT16: of:=AVERAGE([.V16:.AE16]) -> 1 | AU16: of:=STDEV([.V16:.AE16]) -> 0 | AV16: of:=AVERAGE([.AF16:.AO16]) -> 1 | AW16: of:=STDEV([.AF16:.AO16]) -> 0
A17: ET INFO SUSPICIOUS Dotted Quad Host MZ Response | B17: 2 | C17: 2 | D17: 2 | E17: 2 | F17: 2 | G17: 2 | H17: 2 | I17: 2 | J17: 2 | K17: 2 | L17: 2 | M17: 2 | N17: 2 | O17: 2 | P17: 2 | Q17: 2 | R17: 2 | S17: 2 | T17: 2 | U17: 2 | V17: 2 | W17: 2 | X17: 2 | Y17: 2 | Z17: 2 | AA17: 2 | AB17: 2 | AC17: 2 | AD17: 2 | AE17: 2 | AF17: 2 | AG17: 2 | AH17: 2 | AI17: 2 | AJ17: 2 | AK17: 2 | AL17: 2 | AM17: 2 | AN17: 2 | AO17: 2 | AP17: of:=AVERAGE([.B17:.K17]) -> 2 | AQ17: of:=STDEV([.B17:.K17]) -> 0 | AR17: of:=AVERAGE([.L17:.U17]) -> 2 | AS17: of:=STDEV([.L17:.U17]) -> 0 | AT17: of:=AVERAGE([.V17:.AE17]) -> 2 | AU17: of:=STDEV([.V17:.AE17]) -> 0 | AV17: of:=AVERAGE([.AF17:.AO17]) -> 2 | AW17: of:=STDEV([.AF17:.AO17]) -> 0
A18: ET INFO SUSPICIOUS SMTP EXE - EXE SMTP Attachment | B18: 2 | C18: 2 | D18: 2 | E18: 2 | F18: 2 | G18: 2 | H18: 2 | I18: 2 | J18: 2 | K18: 2 | L18: 2 | M18: 2 | N18: 2 | O18: 2 | P18: 2 | Q18: 2 | R18: 2 | S18: 2 | T18: 2 | U18: 2 | V18: 2 | W18: 2 | X18: 2 | Y18: 2 | Z18: 2 | AA18: 2 | AB18: 2 | AC18: 2 | AD18: 2 | AE18: 2 | AF18: 2 | AG18: 2 | AH18: 2 | AI18: 2 | AJ18: 2 | AK18: 2 | AL18: 2 | AM18: 2 | AN18: 2 | AO18: 2 | AP18: of:=AVERAGE([.B18:.K18]) -> 2 | AQ18: of:=STDEV([.B18:.K18]) -> 0 | AR18: of:=AVERAGE([.L18:.U18]) -> 2 | AS18: of:=STDEV([.L18:.U18]) -> 0 | AT18: of:=AVERAGE([.V18:.AE18]) -> 2 | AU18: of:=STDEV([.V18:.AE18]) -> 0 | AV18: of:=AVERAGE([.AF18:.AO18]) -> 2 | AW18: of:=STDEV([.AF18:.AO18]) -> 0
A19: ET POLICY PE EXE or DLL Windows file download HTTP | B19: 2 | C19: 2 | D19: 2 | E19: 2 | F19: 2 | G19: 2 | H19: 2 | I19: 2 | J19: 2 | K19: 2 | L19: 2 | M19: 2 | N19: 2 | O19: 2 | P19: 2 | Q19: 2 | R19: 2 | S19: 2 | T19: 2 | U19: 2 | V19: 2 | W19: 2 | X19: 2 | Y19: 2 | Z19: 2 | AA19: 2 | AB19: 2 | AC19: 2 | AD19: 2 | AE19: 2 | AF19: 2 | AG19: 2 | AH19: 2 | AI19: 2 | AJ19: 2 | AK19: 2 | AL19: 2 | AM19: 2 | AN19: 2 | AO19: 2 | AP19: of:=AVERAGE([.B19:.K19]) -> 2 | AQ19: of:=STDEV([.B19:.K19]) -> 0 | AR19: of:=AVERAGE([.L19:.U19]) -> 2 | AS19: of:=STDEV([.L19:.U19]) -> 0 | AT19: of:=AVERAGE([.V19:.AE19]) -> 2 | AU19: of:=STDEV([.V19:.AE19]) -> 0 | AV19: of:=AVERAGE([.AF19:.AO19]) -> 2 | AW19: of:=STDEV([.AF19:.AO19]) -> 0
A20: ET SCAN Sqlmap SQL Injection Scan | B20: 2 | C20: 2 | D20: 2 | E20: 2 | F20: 2 | G20: 2 | H20: 2 | I20: 2 | J20: 2 | K20: 2 | L20: 2 | M20: 2 | N20: 2 | O20: 2 | P20: 2 | Q20: 2 | R20: 2 | S20: 2 | T20: 2 | U20: 2 | V20: 2 | W20: 2 | X20: 2 | Y20: 2 | Z20: 2 | AA20: 2 | AB20: 2 | AC20: 2 | AD20: 2 | AE20: 2 | AF20: 2 | AG20: 2 | AH20: 2 | AI20: 2 | AJ20: 2 | AK20: 2 | AL20: 2 | AM20: 2 | AN20: 2 | AO20: 2 | AP20: of:=AVERAGE([.B20:.K20]) -> 2 | AQ20: of:=STDEV([.B20:.K20]) -> 0 | AR20: of:=AVERAGE([.L20:.U20]) -> 2 | AS20: of:=STDEV([.L20:.U20]) -> 0 | AT20: of:=AVERAGE([.V20:.AE20]) -> 2 | AU20: of:=STDEV([.V20:.AE20]) -> 0 | AV20: of:=AVERAGE([.AF20:.AO20]) -> 2 | AW20: of:=STDEV([.AF20:.AO20]) -> 0
A21: ET TROJAN Possible Metasploit Payload Common Construct Bind_API (from server) | B21: 2 | C21: 1 | D21: 2 | E21: 1 | F21: 2 | G21: 2 | H21: 2 | I21: 1 | J21: 2 | K21: 2 | L21: 2 | M21: 1 | N21: 2 | O21: 2 | P21: 2 | Q21: 2 | R21: 1 | S21: 2 | T21: 1 | U21: 2 | V21: 2 | W21: 2 | X21: 2 | Y21: 2 | Z21: 2 | AA21: 2 | AB21: 2 | AC21: 2 | AD21: 2 | AE21: 1 | AF21: 2 | AG21: 2 | AH21: 2 | AI21: 1 | AJ21: 2 | AK21: 2 | AL21: 2 | AM21: 2 | AN21: 2 | AO21: 2 | AP21: of:=AVERAGE([.B21:.K21]) -> 1.7 | AQ21: of:=STDEV([.B21:.K21]) -> 0.483045891539648 | AR21: of:=AVERAGE([.L21:.U21]) -> 1.7 | AS21: of:=STDEV([.L21:.U21]) -> 0.483045891539648 | AT21: of:=AVERAGE([.V21:.AE21]) -> 1.9 | AU21: of:=STDEV([.V21:.AE21]) -> 0.316227766016838 | AV21: of:=AVERAGE([.AF21:.AO21]) -> 1.9 | AW21: of:=STDEV([.AF21:.AO21]) -> 0.316227766016838
A22: ET WEB_SERVER ATTACKER SQLi - SELECT and Schema Columns | B22: 8 | C22: 6 | D22: 7 | E22: 6 | F22: 6 | G22: 6 | H22: 6 | I22: 6 | J22: 7 | K22: 6 | L22: 6 | M22: 7 | N22: 7 | O22: 2 | P22: 7 | Q22: 5 | R22: 7 | S22: 6 | T22: 7 | U22: 7 | V22: 8 | W22: 6 | X22: 7 | Y22: 6 | Z22: 7 | AA22: 6 | AB22: 7 | AC22: 6 | AD22: 7 | AE22: 6 | AF22: 6 | AG22: 7 | AH22: 6 | AI22: 7 | AJ22: 6 | AK22: 7 | AL22: 6 | AM22: 6 | AN22: 7 | AO22: 6 | AP22: of:=AVERAGE([.B22:.K22]) -> 6.4 | AQ22: of:=STDEV([.B22:.K22]) -> 0.699205898780101 | AR22: of:=AVERAGE([.L22:.U22]) -> 6.1 | AS22: of:=STDEV([.L22:.U22]) -> 1.59513148186739 | AT22: of:=AVERAGE([.V22:.AE22]) -> 6.6 | AU22: of:=STDEV([.V22:.AE22]) -> 0.699205898780101 | AV22: of:=AVERAGE([.AF22:.AO22]) -> 6.4 | AW22: of:=STDEV([.AF22:.AO22]) -> 0.516397779494322
A23: ET WEB_SERVER Attempt To Access MSSQL xp_cmdshell Stored Procedure Via URI | B23: 1 | C23: 1 | D23: 1 | E23: 1 | F23: 1 | G23: 1 | H23: 1 | I23: 1 | J23: 1 | K23: 1 | L23: 1 | M23: 1 | N23: 1 | O23: 1 | P23: 1 | Q23: 1 | R23: 1 | S23: 1 | T23: 1 | U23: 1 | V23: 1 | W23: 1 | X23: 1 | Y23: 1 | Z23: 1 | AA23: 1 | AB23: 1 | AC23: 1 | AD23: 1 | AE23: 1 | AF23: 1 | AG23: 1 | AH23: 1 | AI23: 1 | AJ23: 1 | AK23: 1 | AL23: 1 | AM23: 1 | AN23: 1 | AO23: 1 | AP23: of:=AVERAGE([.B23:.K23]) -> 1 | AQ23: of:=STDEV([.B23:.K23]) -> 0 | AR23: of:=AVERAGE([.L23:.U23]) -> 1 | AS23: of:=STDEV([.L23:.U23]) -> 0 | AT23: of:=AVERAGE([.V23:.AE23]) -> 1 | AU23: of:=STDEV([.V23:.AE23]) -> 0 | AV23: of:=AVERAGE([.AF23:.AO23]) -> 1 | AW23: of:=STDEV([.AF23:.AO23]) -> 0
A24: ET WEB_SERVER MYSQL Benchmark Command in URI to Consume Server Resources | B24: 2 | C24: 2 | D24: 2 | E24: 2 | F24: 2 | G24: 2 | H24: 2 | I24: 2 | J24: 2 | K24: 2 | L24: 2 | M24: 2 | N24: 2 | O24: 2 | P24: 2 | Q24: 2 | R24: 2 | S24: 2 | T24: 2 | U24: 2 | V24: 2 | W24: 2 | X24: 2 | Y24: 2 | Z24: 2 | AA24: 2 | AB24: 2 | AC24: 2 | AD24: 2 | AE24: 2 | AF24: 2 | AG24: 2 | AH24: 2 | AI24: 2 | AJ24: 2 | AK24: 2 | AL24: 2 | AM24: 2 | AN24: 2 | AO24: 2 | AP24: of:=AVERAGE([.B24:.K24]) -> 2 | AQ24: of:=STDEV([.B24:.K24]) -> 0 | AR24: of:=AVERAGE([.L24:.U24]) -> 2 | AS24: of:=STDEV([.L24:.U24]) -> 0 | AT24: of:=AVERAGE([.V24:.AE24]) -> 2 | AU24: of:=STDEV([.V24:.AE24]) -> 0 | AV24: of:=AVERAGE([.AF24:.AO24]) -> 2 | AW24: of:=STDEV([.AF24:.AO24]) -> 0
A25: ET WEB_SERVER MYSQL SELECT CONCAT SQL Injection Attempt | B25: 22 | C25: 22 | D25: 22 | E25: 22 | F25: 22 | G25: 22 | H25: 22 | I25: 22 | J25: 22 | K25: 22 | L25: 22 | M25: 22 | N25: 22 | O25: 22 | P25: 22 | Q25: 22 | R25: 22 | S25: 22 | T25: 22 | U25: 22 | V25: 22 | W25: 22 | X25: 22 | Y25: 22 | Z25: 22 | AA25: 22 | AB25: 22 | AC25: 22 | AD25: 22 | AE25: 22 | AF25: 22 | AG25: 22 | AH25: 22 | AI25: 22 | AJ25: 22 | AK25: 22 | AL25: 22 | AM25: 22 | AN25: 22 | AO25: 22 | AP25: of:=AVERAGE([.B25:.K25]) -> 22 | AQ25: of:=STDEV([.B25:.K25]) -> 0 | AR25: of:=AVERAGE([.L25:.U25]) -> 22 | AS25: of:=STDEV([.L25:.U25]) -> 0 | AT25: of:=AVERAGE([.V25:.AE25]) -> 22 | AU25: of:=STDEV([.V25:.AE25]) -> 0 | AV25: of:=AVERAGE([.AF25:.AO25]) -> 22 | AW25: of:=STDEV([.AF25:.AO25]) -> 0
A26: ET WEB_SERVER Possible attempt to enumerate MS SQL Server version | B26: 2 | C26: 2 | D26: 2 | E26: 2 | F26: 2 | G26: 2 | H26: 2 | I26: 2 | J26: 2 | K26: 2 | L26: 2 | M26: 2 | N26: 2 | O26: 2 | P26: 2 | Q26: 2 | R26: 2 | S26: 2 | T26: 2 | U26: 2 | V26: 2 | W26: 2 | X26: 2 | Y26: 2 | Z26: 2 | AA26: 2 | AB26: 2 | AC26: 2 | AD26: 2 | AE26: 2 | AF26: 2 | AG26: 2 | AH26: 2 | AI26: 2 | AJ26: 2 | AK26: 2 | AL26: 2 | AM26: 2 | AN26: 2 | AO26: 2 | AP26: of:=AVERAGE([.B26:.K26]) -> 2 | AQ26: of:=STDEV([.B26:.K26]) -> 0 | AR26: of:=AVERAGE([.L26:.U26]) -> 2 | AS26: of:=STDEV([.L26:.U26]) -> 0 | AT26: of:=AVERAGE([.V26:.AE26]) -> 2 | AU26: of:=STDEV([.V26:.AE26]) -> 0 | AV26: of:=AVERAGE([.AF26:.AO26]) -> 2 | AW26: of:=STDEV([.AF26:.AO26]) -> 0
A27: ET WEB_SERVER Possible Attempt to Get SQL Server Version in URI using SELECT VERSION | B27: 6 | C27: 6 | D27: 6 | E27: 6 | F27: 6 | G27: 6 | H27: 6 | I27: 6 | J27: 6 | K27: 6 | L27: 6 | M27: 6 | N27: 6 | O27: 6 | P27: 6 | Q27: 6 | R27: 6 | S27: 6 | T27: 6 | U27: 6 | V27: 6 | W27: 6 | X27: 6 | Y27: 6 | Z27: 6 | AA27: 6 | AB27: 6 | AC27: 6 | AD27: 6 | AE27: 6 | AF27: 6 | AG27: 6 | AH27: 6 | AI27: 6 | AJ27: 6 | AK27: 6 | AL27: 6 | AM27: 6 | AN27: 6 | AO27: 6 | AP27: of:=AVERAGE([.B27:.K27]) -> 6 | AQ27: of:=STDEV([.B27:.K27]) -> 0 | AR27: of:=AVERAGE([.L27:.U27]) -> 6 | AS27: of:=STDEV([.L27:.U27]) -> 0 | AT27: of:=AVERAGE([.V27:.AE27]) -> 6 | AU27: of:=STDEV([.V27:.AE27]) -> 0 | AV27: of:=AVERAGE([.AF27:.AO27]) -> 6 | AW27: of:=STDEV([.AF27:.AO27]) -> 0
A28: ET WEB_SERVER Possible MySQL SQLi Attempt Information Schema Access | B28: 4 | C28: 4 | D28: 4 | E28: 4 | F28: 4 | G28: 4 | H28: 4 | I28: 4 | J28: 4 | K28: 4 | L28: 4 | M28: 4 | N28: 4 | O28: 4 | P28: 4 | Q28: 4 | R28: 4 | S28: 4 | T28: 4 | U28: 4 | V28: 4 | W28: 4 | X28: 4 | Y28: 4 | Z28: 4 | AA28: 4 | AB28: 4 | AC28: 4 | AD28: 4 | AE28: 4 | AF28: 4 | AG28: 4 | AH28: 4 | AI28: 4 | AJ28: 4 | AK28: 4 | AL28: 4 | AM28: 4 | AN28: 4 | AO28: 4 | AP28: of:=AVERAGE([.B28:.K28]) -> 4 | AQ28: of:=STDEV([.B28:.K28]) -> 0 | AR28: of:=AVERAGE([.L28:.U28]) -> 4 | AS28: of:=STDEV([.L28:.U28]) -> 0 | AT28: of:=AVERAGE([.V28:.AE28]) -> 4 | AU28: of:=STDEV([.V28:.AE28]) -> 0 | AV28: of:=AVERAGE([.AF28:.AO28]) -> 4 | AW28: of:=STDEV([.AF28:.AO28]) -> 0
A29: ET WEB_SERVER Possible SQL Injection Attempt SELECT FROM | B29: 16 | C29: 16 | D29: 16 | E29: 16 | F29: 16 | G29: 16 | H29: 16 | I29: 16 | J29: 16 | K29: 16 | L29: 16 | M29: 16 | N29: 16 | O29: 16 | P29: 16 | Q29: 16 | R29: 16 | S29: 16 | T29: 16 | U29: 16 | V29: 16 | W29: 16 | X29: 16 | Y29: 16 | Z29: 16 | AA29: 16 | AB29: 16 | AC29: 16 | AD29: 16 | AE29: 16 | AF29: 16 | AG29: 16 | AH29: 16 | AI29: 16 | AJ29: 16 | AK29: 16 | AL29: 16 | AM29: 16 | AN29: 16 | AO29: 16 | AP29: of:=AVERAGE([.B29:.K29]) -> 16 | AQ29: of:=STDEV([.B29:.K29]) -> 0 | AR29: of:=AVERAGE([.L29:.U29]) -> 16 | AS29: of:=STDEV([.L29:.U29]) -> 0 | AT29: of:=AVERAGE([.V29:.AE29]) -> 16 | AU29: of:=STDEV([.V29:.AE29]) -> 0 | AV29: of:=AVERAGE([.AF29:.AO29]) -> 16 | AW29: of:=STDEV([.AF29:.AO29]) -> 0
A30: ET WEB_SERVER Possible SQL Injection Attempt UNION SELECT | B30: 19 | C30: 19 | D30: 19 | E30: 19 | F30: 19 | G30: 19 | H30: 19 | I30: 19 | J30: 19 | K30: 19 | L30: 19 | M30: 19 | N30: 19 | O30: 19 | P30: 19 | Q30: 19 | R30: 19 | S30: 19 | T30: 19 | U30: 19 | V30: 19 | W30: 19 | X30: 19 | Y30: 19 | Z30: 19 | AA30: 19 | AB30: 19 | AC30: 19 | AD30: 19 | AE30: 19 | AF30: 19 | AG30: 19 | AH30: 19 | AI30: 19 | AJ30: 19 | AK30: 19 | AL30: 19 | AM30: 19 | AN30: 19 | AO30: 19 | AP30: of:=AVERAGE([.B30:.K30]) -> 19 | AQ30: of:=STDEV([.B30:.K30]) -> 0 | AR30: of:=AVERAGE([.L30:.U30]) -> 19 | AS30: of:=STDEV([.L30:.U30]) -> 0 | AT30: of:=AVERAGE([.V30:.AE30]) -> 19 | AU30: of:=STDEV([.V30:.AE30]) -> 0 | AV30: of:=AVERAGE([.AF30:.AO30]) -> 19 | AW30: of:=STDEV([.AF30:.AO30]) -> 0
A31: ET WEB_SERVER Script tag in URI Possible Cross Site Scripting Attempt | B31: 1 | C31: 1 | D31: 1 | E31: 1 | F31: 1 | G31: 1 | H31: 1 | I31: 1 | J31: 1 | K31: 1 | L31: 1 | M31: 1 | N31: 1 | O31: 1 | P31: 1 | Q31: 1 | R31: 1 | S31: 1 | T31: 1 | U31: 1 | V31: 1 | W31: 1 | X31: 1 | Y31: 1 | Z31: 1 | AA31: 1 | AB31: 1 | AC31: 1 | AD31: 1 | AE31: 1 | AF31: 1 | AG31: 1 | AH31: 1 | AI31: 1 | AJ31: 1 | AK31: 1 | AL31: 1 | AM31: 1 | AN31: 1 | AO31: 1 | AP31: of:=AVERAGE([.B31:.K31]) -> 1 | AQ31: of:=STDEV([.B31:.K31]) -> 0 | AR31: of:=AVERAGE([.L31:.U31]) -> 1 | AS31: of:=STDEV([.L31:.U31]) -> 0 | AT31: of:=AVERAGE([.V31:.AE31]) -> 1 | AU31: of:=STDEV([.V31:.AE31]) -> 0 | AV31: of:=AVERAGE([.AF31:.AO31]) -> 1 | AW31: of:=STDEV([.AF31:.AO31]) -> 0
A32: ET WEB_SERVER SQL Errors in HTTP 200 Response (error in your SQL syntax) | B32: 36 | C32: 36 | D32: 36 | E32: 36 | F32: 36 | G32: 36 | H32: 36 | I32: 36 | J32: 36 | K32: 36 | L32: 36 | M32: 36 | N32: 36 | O32: 36 | P32: 36 | Q32: 36 | R32: 36 | S32: 36 | T32: 36 | U32: 36 | V32: 36 | W32: 36 | X32: 36 | Y32: 36 | Z32: 36 | AA32: 36 | AB32: 36 | AC32: 36 | AD32: 36 | AE32: 36 | AF32: 36 | AG32: 36 | AH32: 36 | AI32: 36 | AJ32: 36 | AK32: 36 | AL32: 36 | AM32: 36 | AN32: 36 | AO32: 36 | AP32: of:=AVERAGE([.B32:.K32]) -> 36 | AQ32: of:=STDEV([.B32:.K32]) -> 0 | AR32: of:=AVERAGE([.L32:.U32]) -> 36 | AS32: of:=STDEV([.L32:.U32]) -> 0 | AT32: of:=AVERAGE([.V32:.AE32]) -> 36 | AU32: of:=STDEV([.V32:.AE32]) -> 0 | AV32: of:=AVERAGE([.AF32:.AO32]) -> 36 | AW32: of:=STDEV([.AF32:.AO32]) -> 0
A33: ET WEB_SERVER SQL Injection Select Sleep Time Delay | B33: 7 | C33: 7 | D33: 7 | E33: 7 | F33: 7 | G33: 7 | H33: 7 | I33: 7 | J33: 7 | K33: 7 | L33: 7 | M33: 7 | N33: 7 | O33: 7 | P33: 7 | Q33: 7 | R33: 7 | S33: 7 | T33: 7 | U33: 7 | V33: 7 | W33: 7 | X33: 7 | Y33: 7 | Z33: 7 | AA33: 7 | AB33: 7 | AC33: 7 | AD33: 7 | AE33: 7 | AF33: 7 | AG33: 7 | AH33: 7 | AI33: 7 | AJ33: 7 | AK33: 7 | AL33: 7 | AM33: 7 | AN33: 7 | AO33: 7 | AP33: of:=AVERAGE([.B33:.K33]) -> 7 | AQ33: of:=STDEV([.B33:.K33]) -> 0 | AR33: of:=AVERAGE([.L33:.U33]) -> 7 | AS33: of:=STDEV([.L33:.U33]) -> 0 | AT33: of:=AVERAGE([.V33:.AE33]) -> 7 | AU33: of:=STDEV([.V33:.AE33]) -> 0 | AV33: of:=AVERAGE([.AF33:.AO33]) -> 7 | AW33: of:=STDEV([.AF33:.AO33]) -> 0
A34: Attack steps
A35: Scan and exploit web server | B35: of:=SUM([.B22:.B33])+[.B20] -> 126 | C35: of:=SUM([.C22:.C33])+[.C20] -> 124 | D35: of:=SUM([.D22:.D33])+[.D20] -> 125 | E35: of:=SUM([.E22:.E33])+[.E20] -> 124 | F35: of:=SUM([.F22:.F33])+[.F20] -> 124 | G35: of:=SUM([.G22:.G33])+[.G20] -> 124 | H35: of:=SUM([.H22:.H33])+[.H20] -> 124 | I35: of:=SUM([.I22:.I33])+[.I20] -> 124 | J35: of:=SUM([.J22:.J33])+[.J20] -> 125 | K35: of:=SUM([.K22:.K33])+[.K20] -> 124 | L35: of:=SUM([.L22:.L33])+[.L20] -> 124 | M35: of:=SUM([.M22:.M33])+[.M20] -> 125 | N35: of:=SUM([.N22:.N33])+[.N20] -> 125 | O35: of:=SUM([.O22:.O33])+[.O20] -> 120 | P35: of:=SUM([.P22:.P33])+[.P20] -> 125 | Q35: of:=SUM([.Q22:.Q33])+[.Q20] -> 123 | R35: of:=SUM([.R22:.R33])+[.R20] -> 125 | S35: of:=SUM([.S22:.S33])+[.S20] -> 124 | T35: of:=SUM([.T22:.T33])+[.T20] -> 125 | U35: of:=SUM([.U22:.U33])+[.U20] -> 125 | V35: of:=SUM([.V22:.V33])+[.V20] -> 126 | W35: of:=SUM([.W22:.W33])+[.W20] -> 124 | X35: of:=SUM([.X22:.X33])+[.X20] -> 125 | Y35: of:=SUM([.Y22:.Y33])+[.Y20] -> 124 | Z35: of:=SUM([.Z22:.Z33])+[.Z20] -> 125 | AA35: of:=SUM([.AA22:.AA33])+[.AA20] -> 124 | AB35: of:=SUM([.AB22:.AB33])+[.AB20] -> 125 | AC35: of:=SUM([.AC22:.AC33])+[.AC20] -> 124 | AD35: of:=SUM([.AD22:.AD33])+[.AD20] -> 125 | AE35: of:=SUM([.AE22:.AE33])+[.AE20] -> 124 | AF35: of:=SUM([.AF22:.AF33])+[.AF20] -> 124 | AG35: of:=SUM([.AG22:.AG33])+[.AG20] -> 125 | AH35: of:=SUM([.AH22:.AH33])+[.AH20] -> 124 | AI35: of:=SUM([.AI22:.AI33])+[.AI20] -> 125 | AJ35: of:=SUM([.AJ22:.AJ33])+[.AJ20] -> 124 | AK35: of:=SUM([.AK22:.AK33])+[.AK20] -> 125 | AL35: of:=SUM([.AL22:.AL33])+[.AL20] -> 124 | AM35: of:=SUM([.AM22:.AM33])+[.AM20] -> 124 | AN35: of:=SUM([.AN22:.AN33])+[.AN20] -> 125 | AO35: of:=SUM([.AO22:.AO33])+[.AO20] -> 124 | AP35: of:=AVERAGE([.B35:.K35]) -> 124.4 | AQ35: of:=STDEV([.B35:.K35]) -> 0.699205898780101 | AR35: of:=AVERAGE([.L35:.U35]) -> 124.1 | AS35: of:=STDEV([.L35:.U35]) -> 1.59513148186739 | AT35: of:=AVERAGE([.V35:.AE35]) -> 124.6 | AU35: of:=STDEV([.V35:.AE35]) -> 0.699205898780101 | AV35: of:=AVERAGE([.AF35:.AO35]) -> 124.4 | AW35: of:=STDEV([.AF35:.AO35]) -> 0.516397779494322
A36: Send email with malicious attachment | B36: of:=[.B18] -> 2 | C36: of:=[.C18] -> 2 | D36: of:=[.D18] -> 2 | E36: of:=[.E18] -> 2 | F36: of:=[.F18] -> 2 | G36: of:=[.G18] -> 2 | H36: of:=[.H18] -> 2 | I36: of:=[.I18] -> 2 | J36: of:=[.J18] -> 2 | K36: of:=[.K18] -> 2 | L36: of:=[.L18] -> 2 | M36: of:=[.M18] -> 2 | N36: of:=[.N18] -> 2 | O36: of:=[.O18] -> 2 | P36: of:=[.P18] -> 2 | Q36: of:=[.Q18] -> 2 | R36: of:=[.R18] -> 2 | S36: of:=[.S18] -> 2 | T36: of:=[.T18] -> 2 | U36: of:=[.U18] -> 2 | V36: of:=[.V18] -> 2 | W36: of:=[.W18] -> 2 | X36: of:=[.X18] -> 2 | Y36: of:=[.Y18] -> 2 | Z36: of:=[.Z18] -> 2 | AA36: of:=[.AA18] -> 2 | AB36: of:=[.AB18] -> 2 | AC36: of:=[.AC18] -> 2 | AD36: of:=[.AD18] -> 2 | AE36: of:=[.AE18] -> 2 | AF36: of:=[.AF18] -> 2 | AG36: of:=[.AG18] -> 2 | AH36: of:=[.AH18] -> 2 | AI36: of:=[.AI18] -> 2 | AJ36: of:=[.AJ18] -> 2 | AK36: of:=[.AK18] -> 2 | AL36: of:=[.AL18] -> 2 | AM36: of:=[.AM18] -> 2 | AN36: of:=[.AN18] -> 2 | AO36: of:=[.AO18] -> 2 | AP36: of:=AVERAGE([.B36:.K36]) -> 2 | AQ36: of:=STDEV([.B36:.K36]) -> 0 | AR36: of:=AVERAGE([.L36:.U36]) -> 2 | AS36: of:=STDEV([.L36:.U36]) -> 0 | AT36: of:=AVERAGE([.V36:.AE36]) -> 2 | AU36: of:=STDEV([.V36:.AE36]) -> 0 | AV36: of:=AVERAGE([.AF36:.AO36]) -> 2 | AW36: of:=STDEV([.AF36:.AO36]) -> 0
A37: Open malicious attachment | B37: of:=[.B19]/2+[.B16]+[.B17]/2+[.B14]+[.B21] -> 6 | C37: of:=[.C19]/2+[.C16]+[.C17]/2+[.C14]+[.C21] -> 5 | D37: of:=[.D19]/2+[.D16]+[.D17]/2+[.D14]+[.D21] -> 6 | E37: of:=[.E19]/2+[.E16]+[.E17]/2+[.E14]+[.E21] -> 5 | F37: of:=[.F19]/2+[.F16]+[.F17]/2+[.F14]+[.F21] -> 6 | G37: of:=[.G19]/2+[.G16]+[.G17]/2+[.G14]+[.G21] -> 6 | H37: of:=[.H19]/2+[.H16]+[.H17]/2+[.H14]+[.H21] -> 6 | I37: of:=[.I19]/2+[.I16]+[.I17]/2+[.I14]+[.I21] -> 5 | J37: of:=[.J19]/2+[.J16]+[.J17]/2+[.J14]+[.J21] -> 6 | K37: of:=[.K19]/2+[.K16]+[.K17]/2+[.K14]+[.K21] -> 6 | L37: of:=[.L19]/2+[.L16]+[.L17]/2+[.L14]+[.L21] -> 6 | M37: of:=[.M19]/2+[.M16]+[.M17]/2+[.M14]+[.M21] -> 5 | N37: of:=[.N19]/2+[.N16]+[.N17]/2+[.N14]+[.N21] -> 6 | O37: of:=[.O19]/2+[.O16]+[.O17]/2+[.O14]+[.O21] -> 6 | P37: of:=[.P19]/2+[.P16]+[.P17]/2+[.P14]+[.P21] -> 6 | Q37: of:=[.Q19]/2+[.Q16]+[.Q17]/2+[.Q14]+[.Q21] -> 6 | R37: of:=[.R19]/2+[.R16]+[.R17]/2+[.R14]+[.R21] -> 5 | S37: of:=[.S19]/2+[.S16]+[.S17]/2+[.S14]+[.S21] -> 6 | T37: of:=[.T19]/2+[.T16]+[.T17]/2+[.T14]+[.T21] -> 5 | U37: of:=[.U19]/2+[.U16]+[.U17]/2+[.U14]+[.U21] -> 6 | V37: of:=[.V19]/2+[.V16]+[.V17]/2+[.V14]+[.V21] -> 6 | W37: of:=[.W19]/2+[.W16]+[.W17]/2+[.W14]+[.W21] -> 6 | X37: of:=[.X19]/2+[.X16]+[.X17]/2+[.X14]+[.X21] -> 6 | Y37: of:=[.Y19]/2+[.Y16]+[.Y17]/2+[.Y14]+[.Y21] -> 6 | Z37: of:=[.Z19]/2+[.Z16]+[.Z17]/2+[.Z14]+[.Z21] -> 6 | AA37: of:=[.AA19]/2+[.AA16]+[.AA17]/2+[.AA14]+[.AA21] -> 6 | AB37: of:=[.AB19]/2+[.AB16]+[.AB17]/2+[.AB14]+[.AB21] -> 6 | AC37: of:=[.AC19]/2+[.AC16]+[.AC17]/2+[.AC14]+[.AC21] -> 6 | AD37: of:=[.AD19]/2+[.AD16]+[.AD17]/2+[.AD14]+[.AD21] -> 6 | AE37: of:=[.AE19]/2+[.AE16]+[.AE17]/2+[.AE14]+[.AE21] -> 5 | AF37: of:=[.AF19]/2+[.AF16]+[.AF17]/2+[.AF14]+[.AF21] -> 6 | AG37: of:=[.AG19]/2+[.AG16]+[.AG17]/2+[.AG14]+[.AG21] -> 6 | AH37: of:=[.AH19]/2+[.AH16]+[.AH17]/2+[.AH14]+[.AH21] -> 6 | AI37: of:=[.AI19]/2+[.AI16]+[.AI17]/2+[.AI14]+[.AI21] -> 5 | AJ37: of:=[.AJ19]/2+[.AJ16]+[.AJ17]/2+[.AJ14]+[.AJ21] -> 6 | AK37: of:=[.AK19]/2+[.AK16]+[.AK17]/2+[.AK14]+[.AK21] -> 6 | AL37: of:=[.AL19]/2+[.AL16]+[.AL17]/2+[.AL14]+[.AL21] -> 6 | AM37: of:=[.AM19]/2+[.AM16]+[.AM17]/2+[.AM14]+[.AM21] -> 6 | AN37: of:=[.AN19]/2+[.AN16]+[.AN17]/2+[.AN14]+[.AN21] -> 6 | AO37: of:=[.AO19]/2+[.AO16]+[.AO17]/2+[.AO14]+[.AO21] -> 6 | AP37: of:=AVERAGE([.B37:.K37]) -> 5.7 | AQ37: of:=STDEV([.B37:.K37]) -> 0.483045891539648 | AR37: of:=AVERAGE([.L37:.U37]) -> 5.7 | AS37: of:=STDEV([.L37:.U37]) -> 0.483045891539648 | AT37: of:=AVERAGE([.V37:.AE37]) -> 5.9 | AU37: of:=STDEV([.V37:.AE37]) -> 0.316227766016838 | AV37: of:=AVERAGE([.AF37:.AO37]) -> 5.9 | AW37: of:=STDEV([.AF37:.AO37]) -> 0.316227766016838
A38: Capture screen | B38: 0 | C38: 0 | D38: 0 | E38: 0 | F38: 0 | G38: 0 | H38: 0 | I38: 0 | J38: 0 | K38: 0 | L38: 0 | M38: 0 | N38: 0 | O38: 0 | P38: 0 | Q38: 0 | R38: 0 | S38: 0 | T38: 0 | U38: 0 | V38: 0 | W38: 0 | X38: 0 | Y38: 0 | Z38: 0 | AA38: 0 | AB38: 0 | AC38: 0 | AD38: 0 | AE38: 0 | AF38: 0 | AG38: 0 | AH38: 0 | AI38: 0 | AJ38: 0 | AK38: 0 | AL38: 0 | AM38: 0 | AN38: 0 | AO38: 0 | AP38: of:=AVERAGE([.B38:.K38]) -> 0 | AQ38: of:=STDEV([.B38:.K38]) -> 0 | AR38: of:=AVERAGE([.L38:.U38]) -> 0 | AS38: of:=STDEV([.L38:.U38]) -> 0 | AT38: of:=AVERAGE([.V38:.AE38]) -> 0 | AU38: of:=STDEV([.V38:.AE38]) -> 0 | AV38: of:=AVERAGE([.AF38:.AO38]) -> 0 | AW38: of:=STDEV([.AF38:.AO38]) -> 0
A39: Collect cached credentials with elevated privileges | B39: of:=[.B10] -> 0 | C39: of:=[.C10] -> 0 | D39: of:=[.D10] -> 0 | E39: of:=[.E10] -> 0 | F39: of:=[.F10] -> 0 | G39: of:=[.G10] -> 0 | H39: of:=[.H10] -> 0 | I39: of:=[.I10] -> 0 | J39: of:=[.J10] -> 0 | K39: of:=[.K10] -> 0 | L39: of:=[.L10] -> 1 | M39: of:=[.M10] -> 1 | N39: of:=[.N10] -> 1 | O39: of:=[.O10] -> 1 | P39: of:=[.P10] -> 1 | Q39: of:=[.Q10] -> 1 | R39: of:=[.R10] -> 1 | S39: of:=[.S10] -> 1 | T39: of:=[.T10] -> 1 | U39: of:=[.U10] -> 1 | V39: of:=[.V10] -> 0 | W39: of:=[.W10] -> 0 | X39: of:=[.X10] -> 0 | Y39: of:=[.Y10] -> 0 | Z39: of:=[.Z10] -> 0 | AA39: of:=[.AA10] -> 0 | AB39: of:=[.AB10] -> 0 | AC39: of:=[.AC10] -> 0 | AD39: of:=[.AD10] -> 0 | AE39: of:=[.AE10] -> 0 | AF39: of:=[.AF10] -> 1 | AG39: of:=[.AG10] -> 1 | AH39: of:=[.AH10] -> 1 | AI39: of:=[.AI10] -> 1 | AJ39: of:=[.AJ10] -> 1 | AK39: of:=[.AK10] -> 1 | AL39: of:=[.AL10] -> 1 | AM39: of:=[.AM10] -> 1 | AN39: of:=[.AN10] -> 1 | AO39: of:=[.AO10] -> 1 | AP39: of:=AVERAGE([.B39:.K39]) -> 0 | AQ39: of:=STDEV([.B39:.K39]) -> 0 | AR39: of:=AVERAGE([.L39:.U39]) -> 1 | AS39: of:=STDEV([.L39:.U39]) -> 0 | AT39: of:=AVERAGE([.V39:.AE39]) -> 0 | AU39: of:=STDEV([.V39:.AE39]) -> 0 | AV39: of:=AVERAGE([.AF39:.AO39]) -> 1 | AW39: of:=STDEV([.AF39:.AO39]) -> 0
A40: Search network and download files | B40: 0 | C40: 0 | D40: 0 | E40: 0 | F40: 0 | G40: 0 | H40: 0 | I40: 0 | J40: 0 | K40: 0 | L40: 0 | M40: 0 | N40: 0 | O40: 0 | P40: 0 | Q40: 0 | R40: 0 | S40: 0 | T40: 0 | U40: 0 | V40: 0 | W40: 0 | X40: 0 | Y40: 0 | Z40: 0 | AA40: 0 | AB40: 0 | AC40: 0 | AD40: 0 | AE40: 0 | AF40: 0 | AG40: 0 | AH40: 0 | AI40: 0 | AJ40: 0 | AK40: 0 | AL40: 0 | AM40: 0 | AN40: 0 | AO40: 0 | AP40: of:=AVERAGE([.B40:.K40]) -> 0 | AQ40: of:=STDEV([.B40:.K40]) -> 0 | AR40: of:=AVERAGE([.L40:.U40]) -> 0 | AS40: of:=STDEV([.L40:.U40]) -> 0 | AT40: of:=AVERAGE([.V40:.AE40]) -> 0 | AU40: of:=STDEV([.V40:.AE40]) -> 0 | AV40: of:=AVERAGE([.AF40:.AO40]) -> 0 | AW40: of:=STDEV([.AF40:.AO40]) -> 0
A41: Download custom backdoor | B41: of:=[.B15]+[.B19]/2+[.B17]/2+[.B12]+[.B11] -> 3 | C41: of:=[.C15]+[.C19]/2+[.C17]/2+[.C12]+[.C11] -> 3 | D41: of:=[.D15]+[.D19]/2+[.D17]/2+[.D12]+[.D11] -> 3 | E41: of:=[.E15]+[.E19]/2+[.E17]/2+[.E12]+[.E11] -> 3 | F41: of:=[.F15]+[.F19]/2+[.F17]/2+[.F12]+[.F11] -> 3 | G41: of:=[.G15]+[.G19]/2+[.G17]/2+[.G12]+[.G11] -> 3 | H41: of:=[.H15]+[.H19]/2+[.H17]/2+[.H12]+[.H11] -> 3 | I41: of:=[.I15]+[.I19]/2+[.I17]/2+[.I12]+[.I11] -> 3 | J41: of:=[.J15]+[.J19]/2+[.J17]/2+[.J12]+[.J11] -> 3 | K41: of:=[.K15]+[.K19]/2+[.K17]/2+[.K12]+[.K11] -> 3 | L41: of:=[.L15]+[.L19]/2+[.L17]/2+[.L12]+[.L11] -> 7 | M41: of:=[.M15]+[.M19]/2+[.M17]/2+[.M12]+[.M11] -> 7 | N41: of:=[.N15]+[.N19]/2+[.N17]/2+[.N12]+[.N11] -> 7 | O41: of:=[.O15]+[.O19]/2+[.O17]/2+[.O12]+[.O11] -> 7 | P41: of:=[.P15]+[.P19]/2+[.P17]/2+[.P12]+[.P11] -> 7 | Q41: of:=[.Q15]+[.Q19]/2+[.Q17]/2+[.Q12]+[.Q11] -> 7 | R41: of:=[.R15]+[.R19]/2+[.R17]/2+[.R12]+[.R11] -> 7 | S41: of:=[.S15]+[.S19]/2+[.S17]/2+[.S12]+[.S11] -> 7 | T41: of:=[.T15]+[.T19]/2+[.T17]/2+[.T12]+[.T11] -> 7 | U41: of:=[.U15]+[.U19]/2+[.U17]/2+[.U12]+[.U11] -> 7 | V41: of:=[.V15]+[.V19]/2+[.V17]/2+[.V12]+[.V11] -> 3 | W41: of:=[.W15]+[.W19]/2+[.W17]/2+[.W12]+[.W11] -> 3 | X41: of:=[.X15]+[.X19]/2+[.X17]/2+[.X12]+[.X11] -> 3 | Y41: of:=[.Y15]+[.Y19]/2+[.Y17]/2+[.Y12]+[.Y11] -> 3 | Z41: of:=[.Z15]+[.Z19]/2+[.Z17]/2+[.Z12]+[.Z11] -> 3 | AA41: of:=[.AA15]+[.AA19]/2+[.AA17]/2+[.AA12]+[.AA11] -> 3 | AB41: of:=[.AB15]+[.AB19]/2+[.AB17]/2+[.AB12]+[.AB11] -> 3 | AC41: of:=[.AC15]+[.AC19]/2+[.AC17]/2+[.AC12]+[.AC11] -> 3 | AD41: of:=[.AD15]+[.AD19]/2+[.AD17]/2+[.AD12]+[.AD11] -> 3 | AE41: of:=[.AE15]+[.AE19]/2+[.AE17]/2+[.AE12]+[.AE11] -> 3 | AF41: of:=[.AF15]+[.AF19]/2+[.AF17]/2+[.AF12]+[.AF11] -> 7 | AG41: of:=[.AG15]+[.AG19]/2+[.AG17]/2+[.AG12]+[.AG11] -> 7 | AH41: of:=[.AH15]+[.AH19]/2+[.AH17]/2+[.AH12]+[.AH11] -> 7 | AI41: of:=[.AI15]+[.AI19]/2+[.AI17]/2+[.AI12]+[.AI11] -> 7 | AJ41: of:=[.AJ15]+[.AJ19]/2+[.AJ17]/2+[.AJ12]+[.AJ11] -> 7 | AK41: of:=[.AK15]+[.AK19]/2+[.AK17]/2+[.AK12]+[.AK11] -> 7 | AL41: of:=[.AL15]+[.AL19]/2+[.AL17]/2+[.AL12]+[.AL11] -> 7 | AM41: of:=[.AM15]+[.AM19]/2+[.AM17]/2+[.AM12]+[.AM11] -> 7 | AN41: of:=[.AN15]+[.AN19]/2+[.AN17]/2+[.AN12]+[.AN11] -> 7 | AO41: of:=[.AO15]+[.AO19]/2+[.AO17]/2+[.AO12]+[.AO11] -> 7 | AP41: of:=AVERAGE([.B41:.K41]) -> 3 | AQ41: of:=STDEV([.B41:.K41]) -> 0 | AR41: of:=AVERAGE([.L41:.U41]) -> 7 | AS41: of:=STDEV([.L41:.U41]) -> 0 | AT41: of:=AVERAGE([.V41:.AE41]) -> 3 | AU41: of:=STDEV([.V41:.AE41]) -> 0 | AV41: of:=AVERAGE([.AF41:.AO41]) -> 7 | AW41: of:=STDEV([.AF41:.AO41]) -> 0
A42: Set autostart for custom backdoor | B42: of:=[.B9]+[.B8] -> 0 | C42: of:=[.C9]+[.C8] -> 0 | D42: of:=[.D9]+[.D8] -> 0 | E42: of:=[.E9]+[.E8] -> 0 | F42: of:=[.F9]+[.F8] -> 0 | G42: of:=[.G9]+[.G8] -> 0 | H42: of:=[.H9]+[.H8] -> 0 | I42: of:=[.I9]+[.I8] -> 0 | J42: of:=[.J9]+[.J8] -> 0 | K42: of:=[.K9]+[.K8] -> 0 | L42: of:=[.L9]+[.L8] -> 2 | M42: of:=[.M9]+[.M8] -> 2 | N42: of:=[.N9]+[.N8] -> 2 | O42: of:=[.O9]+[.O8] -> 2 | P42: of:=[.P9]+[.P8] -> 2 | Q42: of:=[.Q9]+[.Q8] -> 2 | R42: of:=[.R9]+[.R8] -> 2 | S42: of:=[.S9]+[.S8] -> 2 | T42: of:=[.T9]+[.T8] -> 2 | U42: of:=[.U9]+[.U8] -> 2 | V42: of:=[.V9]+[.V8] -> 0 | W42: of:=[.W9]+[.W8] -> 0 | X42: of:=[.X9]+[.X8] -> 0 | Y42: of:=[.Y9]+[.Y8] -> 0 | Z42: of:=[.Z9]+[.Z8] -> 0 | AA42: of:=[.AA9]+[.AA8] -> 0 | AB42: of:=[.AB9]+[.AB8] -> 0 | AC42: of:=[.AC9]+[.AC8] -> 0 | AD42: of:=[.AD9]+[.AD8] -> 0 | AE42: of:=[.AE9]+[.AE8] -> 0 | AF42: of:=[.AF9]+[.AF8] -> 2 | AG42: of:=[.AG9]+[.AG8] -> 2 | AH42: of:=[.AH9]+[.AH8] -> 2 | AI42: of:=[.AI9]+[.AI8] -> 2 | AJ42: of:=[.AJ9]+[.AJ8] -> 2 | AK42: of:=[.AK9]+[.AK8] -> 2 | AL42: of:=[.AL9]+[.AL8] -> 2 | AM42: of:=[.AM9]+[.AM8] -> 2 | AN42: of:=[.AN9]+[.AN8] -> 2 | AO42: of:=[.AO9]+[.AO8] -> 2 | AP42: of:=AVERAGE([.B42:.K42]) -> 0 | AQ42: of:=STDEV([.B42:.K42]) -> 0 | AR42: of:=AVERAGE([.L42:.U42]) -> 2 | AS42: of:=STDEV([.L42:.U42]) -> 0 | AT42: of:=AVERAGE([.V42:.AE42]) -> 0 | AU42: of:=STDEV([.V42:.AE42]) -> 0 | AV42: of:=AVERAGE([.AF42:.AO42]) -> 2 | AW42: of:=STDEV([.AF42:.AO42]) -> 0
A43: Execute custom backdoor | B43: 0 | C43: 0 | D43: 0 | E43: 0 | F43: 0 | G43: 0 | H43: 0 | I43: 0 | J43: 0 | K43: 0 | L43: 0 | M43: 0 | N43: 0 | O43: 0 | P43: 0 | Q43: 0 | R43: 0 | S43: 0 | T43: 0 | U43: 0 | V43: 0 | W43: 0 | X43: 0 | Y43: 0 | Z43: 0 | AA43: 0 | AB43: 0 | AC43: 0 | AD43: 0 | AE43: 0 | AF43: 0 | AG43: 0 | AH43: 0 | AI43: 0 | AJ43: 0 | AK43: 0 | AL43: 0 | AM43: 0 | AN43: 0 | AO43: 0 | AP43: of:=AVERAGE([.B43:.K43]) -> 0 | AQ43: of:=STDEV([.B43:.K43]) -> 0 | AR43: of:=AVERAGE([.L43:.U43]) -> 0 | AS43: of:=STDEV([.L43:.U43]) -> 0 | AT43: of:=AVERAGE([.V43:.AE43]) -> 0 | AU43: of:=STDEV([.V43:.AE43]) -> 0 | AV43: of:=AVERAGE([.AF43:.AO43]) -> 0 | AW43: of:=STDEV([.AF43:.AO43]) -> 0
A45: Sum | B45: of:=SUM([.B35:.B43]) -> 137 | C45: of:=SUM([.C35:.C43]) -> 134 | D45: of:=SUM([.D35:.D43]) -> 136 | E45: of:=SUM([.E35:.E43]) -> 134 | F45: of:=SUM([.F35:.F43]) -> 135 | G45: of:=SUM([.G35:.G43]) -> 135 | H45: of:=SUM([.H35:.H43]) -> 135 | I45: of:=SUM([.I35:.I43]) -> 134 | J45: of:=SUM([.J35:.J43]) -> 136 | K45: of:=SUM([.K35:.K43]) -> 135 | L45: of:=SUM([.L35:.L43]) -> 142 | M45: of:=SUM([.M35:.M43]) -> 142 | N45: of:=SUM([.N35:.N43]) -> 143 | O45: of:=SUM([.O35:.O43]) -> 138 | P45: of:=SUM([.P35:.P43]) -> 143 | Q45: of:=SUM([.Q35:.Q43]) -> 141 | R45: of:=SUM([.R35:.R43]) -> 142 | S45: of:=SUM([.S35:.S43]) -> 142 | T45: of:=SUM([.T35:.T43]) -> 142 | U45: of:=SUM([.U35:.U43]) -> 143 | V45: of:=SUM([.V35:.V43]) -> 137 | W45: of:=SUM([.W35:.W43]) -> 135 | X45: of:=SUM([.X35:.X43]) -> 136 | Y45: of:=SUM([.Y35:.Y43]) -> 135 | Z45: of:=SUM([.Z35:.Z43]) -> 136 | AA45: of:=SUM([.AA35:.AA43]) -> 135 | AB45: of:=SUM([.AB35:.AB43]) -> 136 | AC45: of:=SUM([.AC35:.AC43]) -> 135 | AD45: of:=SUM([.AD35:.AD43]) -> 136 | AE45: of:=SUM([.AE35:.AE43]) -> 134 | AF45: of:=SUM([.AF35:.AF43]) -> 142 | AG45: of:=SUM([.AG35:.AG43]) -> 143 | AH45: of:=SUM([.AH35:.AH43]) -> 142 | AI45: of:=SUM([.AI35:.AI43]) -> 142 | AJ45: of:=SUM([.AJ35:.AJ43]) -> 142 | AK45: of:=SUM([.AK35:.AK43]) -> 143 | AL45: of:=SUM([.AL35:.AL43]) -> 142 | AM45: of:=SUM([.AM35:.AM43]) -> 142 | AN45: of:=SUM([.AN35:.AN43]) -> 143 | AO45: of:=SUM([.AO35:.AO43]) -> 142
A46: Number of detected attack steps | B46: of:=COUNTIF([.B35:.B43];">0") -> 4 | C46: of:=COUNTIF([.C35:.C43];">0") -> 4 | D46: of:=COUNTIF([.D35:.D43];">0") -> 4 | E46: of:=COUNTIF([.E35:.E43];">0") -> 4 | F46: of:=COUNTIF([.F35:.F43];">0") -> 4 | G46: of:=COUNTIF([.G35:.G43];">0") -> 4 | H46: of:=COUNTIF([.H35:.H43];">0") -> 4 | I46: of:=COUNTIF([.I35:.I43];">0") -> 4 | J46: of:=COUNTIF([.J35:.J43];">0") -> 4 | K46: of:=COUNTIF([.K35:.K43];">0") -> 4 | L46: of:=COUNTIF([.L35:.L43];">0") -> 6 | M46: of:=COUNTIF([.M35:.M43];">0") -> 6 | N46: of:=COUNTIF([.N35:.N43];">0") -> 6 | O46: of:=COUNTIF([.O35:.O43];">0") -> 6 | P46: of:=COUNTIF([.P35:.P43];">0") -> 6 | Q46: of:=COUNTIF([.Q35:.Q43];">0") -> 6 | R46: of:=COUNTIF([.R35:.R43];">0") -> 6 | S46: of:=COUNTIF([.S35:.S43];">0") -> 6 | T46: of:=COUNTIF([.T35:.T43];">0") -> 6 | U46: of:=COUNTIF([.U35:.U43];">0") -> 6 | V46: of:=COUNTIF([.V35:.V43];">0") -> 4 | W46: of:=COUNTIF([.W35:.W43];">0") -> 4 | X46: of:=COUNTIF([.X35:.X43];">0") -> 4 | Y46: of:=COUNTIF([.Y35:.Y43];">0") -> 4 | Z46: of:=COUNTIF([.Z35:.Z43];">0") -> 4 | AA46: of:=COUNTIF([.AA35:.AA43];">0") -> 4 | AB46: of:=COUNTIF([.AB35:.AB43];">0") -> 4 | AC46: of:=COUNTIF([.AC35:.AC43];">0") -> 4 | AD46: of:=COUNTIF([.AD35:.AD43];">0") -> 4 | AE46: of:=COUNTIF([.AE35:.AE43];">0") -> 4 | AF46: of:=COUNTIF([.AF35:.AF43];">0") -> 6 | AG46: of:=COUNTIF([.AG35:.AG43];">0") -> 6 | AH46: of:=COUNTIF([.AH35:.AH43];">0") -> 6 | AI46: of:=COUNTIF([.AI35:.AI43];">0") -> 6 | AJ46: of:=COUNTIF([.AJ35:.AJ43];">0") -> 6 | AK46: of:=COUNTIF([.AK35:.AK43];">0") -> 6 | AL46: of:=COUNTIF([.AL35:.AL43];">0") -> 6 | AM46: of:=COUNTIF([.AM35:.AM43];">0") -> 6 | AN46: of:=COUNTIF([.AN35:.AN43];">0") -> 6 | AO46: of:=COUNTIF([.AO35:.AO43];">0") -> 6 | AP46: of:=AVERAGE([.B46:.K46]) -> 4 | AQ46: of:=STDEV([.B46:.K46]) -> 0 | AR46: of:=AVERAGE([.L46:.U46]) -> 6 | AS46: of:=STDEV([.L46:.U46]) -> 0 | AT46: of:=AVERAGE([.V46:.AE46]) -> 4 | AU46: of:=STDEV([.V46:.AE46]) -> 0 | AV46: of:=AVERAGE([.AF46:.AO46]) -> 6 | AW46: of:=STDEV([.AF46:.AO46]) -> 0
A47: First valid ten runs (used for evaluation) | B47: ☻ | C47: ☻ | D47: ☻ | E47: ☻ | F47: ☻ | G47: ☻ | H47: ☻ | I47: ☻ | J47: ☻ | K47: ☻ | L47: ☻ | M47: ☻ | N47: ☻ | O47: ☻ | P47: ☻ | Q47: ☻ | R47: ☻ | S47: ☻ | T47: ☻ | U47: ☻ | V47: ☻ | W47: ☻ | X47: ☻ | Y47: ☻ | Z47: ☻ | AA47: ☻ | AB47: ☻ | AC47: ☻ | AD47: ☻ | AE47: ☻ | AF47: ☻ | AG47: ☻ | AH47: ☻ | AI47: ☻ | AJ47: ☻ | AK47: ☻ | AL47: ☻ | AM47: ☻ | AN47: ☻ | AO47: ☻
A50: t-tests for the differing attack steps | B50: Sample size 1 | F50: 10 | J50: 10 | N50: 10 | R50: 10
B51: Mean 1 | F51: of:=AVERAGE([.B35:.K35]) -> 124.4 | J51: of:=AVERAGE([.L35:.U35]) -> 124.1 | N51: of:=AVERAGE([.B37:.K37]) -> 5.7 | R51: of:=AVERAGE([.L37:.U37]) -> 5.7
B52: SD 1 | F52: 0.699205898780101 | J52: of:=STDEV([.L35:.U35]) -> 1.59513148186739 | N52: of:=STDEV([.B37:.K37]) -> 0.483045891539648 | R52: of:=STDEV([.L37:.U37]) -> 0.483045891539648
B53: Sample size 2 | F53: 10 | J53: 10 | N53: 10 | R53: 10
B54: Mean 2 | F54: of:=AVERAGE([.V35:.AE35]) -> 124.6 | J54: of:=AVERAGE([.AF35:.AO35]) -> 124.4 | N54: of:=AVERAGE([.V37:.AE37]) -> 5.9 | R54: of:=AVERAGE([.AF37:.AO37]) -> 5.9
B55: SD 2 | F55: of:=STDEV([.V35:.AE35]) -> 0.699205898780101 | J55: of:=STDEV([.AF35:.AO35]) -> 0.516397779494322 | N55: of:=STDEV([.V37:.AE37]) -> 0.316227766016838 | R55: of:=STDEV([.AF37:.AO37]) -> 0.316227766016838
B56: p-value | F56: 0.5304882 | J56: 0.5804692 | N56: 0.28859906 | R56: 0.28859906
A58: t-tests for the differing alerts | B58: Sample size 1 | F58: 10 | J58: 10 | N58: 10 | R58: 10
B59: Mean 1 | F59: of:=AVERAGE([.B21:.K21]) -> 1.7 | J59: of:=AVERAGE([.L21:.U21]) -> 1.7 | N59: of:=AVERAGE([.B22:.K22]) -> 6.4 | R59: of:=AVERAGE([.L22:.U22]) -> 6.1
B60: SD 1 | F60: of:=STDEV([.B21:.K21]) -> 0.483045891539648 | J60: of:=STDEV([.L21:.U21]) -> 0.483045891539648 | N60: of:=STDEV([.B22:.K22]) -> 0.699205898780101 | R60: of:=STDEV([.L22:.U22]) -> 1.59513148186739
B61: Sample size 2 | F61: 10 | J61: 10 | N61: 10 | R61: 10
B62: Mean 2 | F62: of:=AVERAGE([.V21:.AE21]) -> 1.9 | J62: of:=AVERAGE([.AF21:.AO21]) -> 1.9 | N62: of:=AVERAGE([.V22:.AE22]) -> 6.6 | R62: of:=AVERAGE([.AF22:.AO22]) -> 6.4
B63: SD 2 | F63: of:=STDEV([.V21:.AE21]) -> 0.316227766016838 | J63: of:=STDEV([.AF21:.AO21]) -> 0.316227766016838 | N63: of:=STDEV([.V22:.AE22]) -> 0.699205898780101 | R63: of:=STDEV([.AF22:.AO22]) -> 0.516397779494322
B64: p-value | F64: 0.28859906 | J64: 0.28859906 | N64: 0.5304882 | R64: 0.5804692
R66: of:=AVERAGE([.F56];[.J56];[.N56];[.R56];[.F64];[.J64];[.N64];[.R64]) -> 0.46651882

Sheet: Analysis of Deviations
B1: ET WEB_SERVER ATTACKER SQLi - SELECT and Schema Columns
D2: ET TROJAN Possible Metasploit Payload Common Construct Bind_API (from server)
B3: dell | C3: mac | D3: dell | E3: mac
A4: 1 | B4: 7 | C4: 6 | D4: 1 | E4: 2
A5: 2 | B5: 6 | C5: 6 | D5: 1 | E5: 2
A6: 3 | B6: 8 | C6: 7 | D6: 2 | E6: 2
A7: 4 | B7: 6 | C7: 8 | D7: 2 | E7: 2
A8: 5 | B8: 6 | C8: 7 | D8: 2 | E8: 2
A9: 6 | B9: 6 | C9: 6 | D9: 2 | E9: 2
A10: 7 | B10: 6 | C10: 7 | D10: 2 | E10: 2
A11: 8 | B11: 7 | C11: 6 | D11: 2 | E11: 2
A12: 9 | B12: 4 | C12: 7 | D12: 1 | E12: 2
A13: 10 | B13: 8 | C13: 7 | D13: 2 | E13: 2
A14: 11 | B14: 4 | C14: 6 | D14: 2 | E14: 2
A15: 12 | B15: 6 | C15: 6 | D15: 2 | E15: 2
A16: 13 | B16: 6 | C16: 6 | D16: 2 | E16: 2
A17: 14 | B17: 6 | C17: 7 | D17: 1 | E17: 2
A18: 15 | B18: 6 | C18: 7 | D18: 1 | E18: 2
A19: 16 | B19: 7 | C19: 6 | D19: 2 | E19: 2
A20: 17 | B20: 7 | C20: 6 | D20: 1 | E20: 2
A21: 18 | B21: 2 | C21: 4 | D21: 1 | E21: 2
A22: 19 | B22: 6 | C22: 6 | D22: 2 | E22: 2
A23: 20 | B23: 7 | C23: 6 | D23: 2 | E23: 2
A24: 21 | B24: 6 | C24: 6 | D24: 2 | E24: 2
A25: 22 | B25: 6 | C25: 7 | D25: 2 | E25: 2
A26: 23 | B26: 7 | C26: 6 | D26: 2 | E26: 2
A27: 24 | B27: 7 | C27: 6 | D27: 1 | E27: 1
A28: 25 | B28: 4 | C28: 7 | D28: 2 | E28: 2
A29: 26 | B29: 6 | C29: 7 | D29: 2 | E29: 2
A30: 27 | B30: 7 | C30: 7 | D30: 2 | E30: 2
A31: 28 | B31: 6 | C31: 7 | D31: 2 | E31: 2
A32: 29 | B32: 7 | C32: 6 | D32: 1 | E32: 2
A33: 30 | B33: 7 | C33: 7 | D33: 2 | E33: 1
A34: 31 | B34: 7 | C34: 2 | D34: 2 | E34: 1
A35: 32 | B35: 6 | C35: 6 | D35: 2 | E35: 2
A36: 33 | B36: 6 | C36: 7 | D36: 2 | E36: 2
A37: 34 | B37: 6 | C37: 6 | D37: 2 | E37: 2
A38: 35 | B38: 6 | C38: 7 | D38: 2 | E38: 2
A40: Mean | B40: of:=AVERAGE([.B4:.B38]) -> 6.14285714285714 | C40: of:=AVERAGE([.C4:.C38]) -> 6.31428571428571 | D40: of:=AVERAGE([.D4:.D38]) -> 1.74285714285714 | E40: of:=AVERAGE([.E4:.E38]) -> 1.91428571428571
A41: SD | B41: of:=STDEV([.B4:.B38]) -> 1.1667667023939 | C41: of:=STDEV([.C4:.C38]) -> 1.02243735811076 | D41: of:=STDEV([.D4:.D38]) -> 0.44343957363116 | E41: of:=STDEV([.E4:.E38]) -> 0.284028640998691
A42: p-value | B42: 0.5155177 | D42: 0.00250766
B44: Manual measurement | D44: Automatic measurement
A45: Packets | B45: dell | C45: mac | D45: dell | E45: mac
A46: Accepted | B46: of:=69256+1774592 -> 1843848 | C46: of:=87453+3597491 -> 3684944 | D46: of:=212451 + 2411080 -> 2623531 | E46: of:=194041 + 2347775 -> 2541816
A47: Dropped | B47: of:=2+1876 -> 1878 | C47: of:=23+10463 -> 10486 | D47: of:=1 + 66 -> 67 | E47: of:=0 + 36 -> 36
A48: Drop Rate | B48: of:=[.B47]/([.B46]+[.B47]) -> 0.00101748580233469 | C48: of:=[.C47]/([.C46]+[.C47]) -> 0.00283755882265393 | D48: of:=[.D47]/([.D46]+[.D47]) -> 0.0000255374489536888 | E48: of:=[.E47]/([.E46]+[.E47]) -> 0.0000141629016952993
B50: 7 | C50: 6
B51: 7 | C51: 6
B52: 7 | C52: 6
B53: 7 | C53: 6
B54: 6 | C54: 6
B55: 6 | C55: 6
B56: 6 | C56: 7
B57: 6 | C57: 6
B58: 7 | C58: 6
B59: 7 | C59: 6
B60: 7 | C60: 6
B61: 4 | C61: 7
B62: 6 | C62: 7
B63: 6 | C63: 7
B64: 7 | C64: 6
B65: 2 | C65: 8
B66: 7 | C66: 6
B67: 7 | C67: 6
B68: 7 | C68: 6
B69: 8 | C69: 6
B70: 6 | C70: 6
B71: 7 | C71: 6
B72: 6 | C72: 6
B73: 7 | C73: 6
B74: 8 | C74: 6
B75: 7 | C75: 6
B76: 6 | C76: 7
B77: 7 | C77: 7
B78: 7 | C78: 7
B79: 7 | C79: 6
B80: 7 | C80: 6
B81: 6 | C81: 6
B82: 6 | C82: 6
B83: 6 | C83: 6
B84: 6 | C84: 7
B85: 6 | C85: 6
B86: 6 | C86: 7
B87: 8 | C87: 6
B88: 6 | C88: 7
B89: 7 | C89: 7
B90: 3 | C90: 6
B91: 3 | C91: 6
B92: 6 | C92: 6
B93: 8 | C93: 6
B94: 6 | C94: 6
B95: 6 | C95: 7
B96: 8 | C96: 6
B97: 2 | C97: 6
B98: 6 | C98: 6
B99: 6 | C99: 6
B100: 6 | C100: 6
B101: 4 | C101: 7
B102: 6 | C102: 8
B103: 2 | C103: 7
B104: 6 | C104: 6
B105: 6 | C105: 6
B106: 7 | C106: 6
B107: 6 | C107: 6
B108: 6 | C108: 6
B109: 6 | C109: 7
B110: 4 | C110: 7
B111: 4 | C111: 7
B112: 6 | C112: 7
B113: 6 | C113: 7
B114: 6 | C114: 6
B115: 7 | C115: 6
B116: 7 | C116: 8
B117: 6 | C117: 6
B118: 2 | C118: 7
B119: 8 | C119: 6
B120: 5 | C120: 6
B121: 6 | C121: 6
B122: 6 | C122: 6
B123: 7 | C123: 6
B124: 7 | C124: 6
B125: 7 | C125: 6
B126: 7 | C126: 6
B127: 6 | C127: 6
B128: 6 | C128: 6
B129: 6 | C129: 6
B130: 6 | C130: 6
B131: 6 | C131: 6
B132: 7 | C132: 6
B133: 4 | C133: 6
B134: 6 | C134: 7
B135: 4 | C135: 6
B136: 6 | C136: 7
B137: 6 | C137: 7
B138: 4 | C138: 7
B139: 6 | C139: 6
B140: 6 | C140: 6
B141: 6 | C141: 4
B142: 6 | C142: 6
B143: 6 | C143: 6
B144: 7 | C144: 6
B145: 7 | C145: 7
B146: 7 | C146: 6
B147: 2 | C147: 6
B148: 6 | C148: 6
B149: 7 | C149: 6
B150: 6 | C150: 7
B151: 6 | C151: 6
B152: 6 | C152: 7
B153: 6 | C153: 6
B154: 6 | C154: 6
B155: 6 | C155: 6
B156: 6 | C156: 6
B157: 6 | C157: 7
B158: 7 | C158: 6
B159: 6 | C159: 7
B160: 6 | C160: 6
B161: 7 | C161: 6
B162: 7 | C162: 6
B163: 6 | C163: 7
B164: 8 | C164: 7
B165: 6 | C165: 6
B166: 6 | C166: 7
B167: 5 | C167: 7
B168: 7 | C168: 6
B169: 7 | C169: 6
B170: 3 | C170: 6
B171: 6 | C171: 6
B172: 6 | C172: 6
B173: 2 | C173: 6
B174: 5 | C174: 6
B175: 6 | C175: 6
B176: 4 | C176: 6
B177: 6 | C177: 6
B178: 8 | C178: 4
B179: 7 | C179: 6
B180: 7 | C180: 6
B181: 6 | C181: 6
B182: 6 | C182: 7
B183: 9 | C183: 6
B184: 6 | C184: 6
B185: 4 | C185: 8
B186: 6 | C186: 7
B187: 6 | C187: 6
B188: 6 | C188: 6
B189: 7 | C189: 6
B190: 6 | C190: 6
B191: 5 | C191: 6
B192: 6 | C192: 6
B193: 6 | C193: 7
B194: 7 | C194: 7
B195: 7 | C195: 6
B196: 6 | C196: 7
B197: 6 | C197: 7
B198: 5 | C198: 6
B199: 6 | C199: 6
B200: 7 | C200: 6
B201: 6 | C201: 7
B202: 6 | C202: 7
B203: 3 | C203: 6
B204: 6 | C204: 6
B205: 3 | C205: 7
B206: 5 | C206: 5
B207: 6 | C207: 7
B208: 7 | C208: 6
B209: 7 | C209: 6
B210: 6 | C210: 7
B211: 3 | C211: 4
B212: 8 | C212: 6
B213: 6 | C213: 6
B214: 6 | C214: 7
B215: 7 | C215: 6
B216: 7 | C216: 6
B217: 6 | C217: 6
B218: 6 | C218: 6
B219: 5 | C219: 7
B220: 6 | C220: 5
B221: 6 | C221: 8
B222: 4 | C222: 6
B223: 7 | C223: 6
B224: 6 | C224: 7
B225: 2 | C225: 6
B226: 7 | C226: 6
B227: 6 | C227: 7
B228: 6 | C228: 8
B229: 4 | C229: 7
B230: 6 | C230: 6
B231: 6 | C231: 7
B232: 2 | C232: 7
B233: 6 | C233: 6
B234: 6 | C234: 6
B235: 7 | C235: 8
B236: 8 | C236: 6
B237: 6 | C237: 6
B238: 7 | C238: 6
B239: 5 | C239: 7
B240: 6 | C240: 6
B241: 7 | C241: 6
B242: 6 | C242: 7
B243: 6 | C243: 8
B244: 2 | C244: 8
B245: 6 | C245: 6
B246: 6 | C246: 6
B247: 6 | C247: 8
B248: 6 | C248: 7
B249: 7 | C249: 6
A251: Mean | B251: of:=AVERAGE([.B50:.B249]) -> 5.955 | C251: of:=AVERAGE([.C50:.C249]) -> 6.33
A252: SD | B252: of:=STDEV([.B50:.B249]) -> 1.32732208585482 | C252: of:=STDEV([.C50:.C249]) -> 0.658229695211551
A253: p-value | B253: 0.00039182